Blog Category,Blog Title,Blog Catchphrase,Blog Link,Author Name,Thumbnail Link,Thumbnail Credit,Blog Date,Author Profile Link
Fashion Trends,This is the timeless designer accessory loved by influencers and fashion editors every summer,And it's a lot more affordable than most.,https://www.glamourmagazine.co.uk/gallery/loewe-basket-bag,Charlie Teather ,https://media.glamourmagazine.co.uk/photos/613892b4236c41e831489437/4:3/w_1600%2Cc_limit/_priscav.jpg,,,
,What EXACTLY Is Sustainable Fashion & Why Is SO Important (2022),,https://thevou.com/fashion/sustainable-fashion/,Ana Alves,https://thevou.com/wp-content/uploads/2019/07/wtvox-what-is-sustainable-fashion-circular.jpg,,21 October 2021,https://thevou.com/author/ana/
Fashion,The Pantone Colour of The Year 2022 is a seriously flattering shade of purple – here are our favourite pieces to shop now,This blue-toned purple hue should be in everyone's wardrobes.,https://www.glamourmagazine.co.uk/gallery/pantone-colour-of-the-year-2022,Alexandra Fullerton ,https://media.glamourmagazine.co.uk/photos/61b35e4c10b71f550900a704/4:3/w_1600%2Cc_limit/PANETON101221_DEFAULTa3.jpg,,,
Shopping,This is the Aussie fashion label everyone from Kim Kardashian to Millie Mackintosh is wearing on Instagram this summer,And it's not super expensive...,https://www.glamourmagazine.co.uk/article/bec-and-bridge-fashion-label-kim-kardashian,Charlie Teather ,https://media.glamourmagazine.co.uk/photos/6138c52f5737943865219f4b/4:3/w_1600%2Cc_limit/elyse.knowles,,,
Fashion Trends,This is the subtle but super chic way that the fashion crowd are wearing their knits this spring,We're desperately trying to resist calling it the 'It Knit'.,https://www.glamourmagazine.co.uk/article/hourglass-cardigan-trend,Charlie Teather ,https://media.glamourmagazine.co.uk/photos/6138a7993335302f7261b79a/4:3/w_1600%2Cc_limit/georginalennon1-_sq.jpg,,,
Shopping,Biker jackets are here to see you through this bizarre summer-but-not-summer weather we're having,Sling one over a summer dress right now,https://www.glamourmagazine.co.uk/gallery/top-20-biker-jackets,Alexandra Fullerton ,https://media.glamourmagazine.co.uk/photos/6138aa6a70a13dae5bdeb3df/4:3/w_1600%2Cc_limit/biker-jackets_sq.jpg,,,
Sales,"Trust me, these are the 21 very best dresses in the summer sales right now",Frugality is fashionable.,https://www.glamourmagazine.co.uk/gallery/best-womens-fashion-sales,Emily Dawes ,https://media.glamourmagazine.co.uk/photos/6138a30769a8a3323e6d833a/4:3/w_1600%2Cc_limit/best.jpg,,,
Fashion,These modest summer dresses will keep you cool and covered up in the heat,Because you should never compromise your sense of self for your style,https://www.glamourmagazine.co.uk/gallery/best-modest-summer-dresses,Alexandra Fullerton ,https://media.glamourmagazine.co.uk/photos/6138ab415341d7d4e342bf39/4:3/w_1600%2Cc_limit/wolfieaziza_sq.jpg,,,
Shopping,"Beaded bags are the accessory everyone's going to be carrying this summer, here are 11 that just scream summer (even if the weather doesn't...)","No one ordered this grey, humid weather.",https://www.glamourmagazine.co.uk/gallery/beaded-bags,Charlie Teather ,https://media.glamourmagazine.co.uk/photos/61388f31fe678a516c682ac6/4:3/w_1600%2Cc_limit/shrimps_sq.jpg,,,
Weddings,"The best summer wedding guest dresses to buy, now that weddings are a thing again",Feel your best on their big day.,https://www.glamourmagazine.co.uk/gallery/summer-wedding-guest-dresses,Sophie Cockett ,https://media.glamourmagazine.co.uk/photos/6138a7515341d7d4e342bd09/4:3/w_1600%2Cc_limit/summer.jpg,,,
High-Street,These 4 incredible summer dresses from Zara will be the first to sell out this season,You'll have to hurry if you want one.,https://www.glamourmagazine.co.uk/article/zara-summer-dresses,Charlie Teather ,https://media.glamourmagazine.co.uk/photos/6138a2803335302f7261b4d0/4:3/w_1600%2Cc_limit/terriface_sq.jpg,,,
Shopping,24 summer dresses you should snap up pronto if you don't fancy having your arms out,Spaghetti straps are cute... when it doesn't suddenly rain.,https://www.glamourmagazine.co.uk/gallery/summer-dresses-with-sleeves,Charlie Teather ,https://media.glamourmagazine.co.uk/photos/6138911fd22f06d735f76a13/4:3/w_1600%2Cc_limit/femmeblk_sq.jpg,,,
,The 5 Rules of Wearing Winter Boots in 2022,,https://www.purewow.com/fashion/winter-boots-style-rules,,"https://purewows3.imgix.net/images/articles/2021_12/winter_boots_style_rules_400.jpg?auto=format,compress&cs=strip",@GRACEATWOOD/INSTAGRAM,,
