Blog Category,Blog Title,Blog Catchphrase,Blog Link,Author Name,Thumbnail Link,Thumbnail Credit,Blog Date,Author Profile Link
,7 Fashion Experts Share Their Predictions for the Top Fashion Trends of 2022,,https://www.instyle.com/fashion/clothing/best-2022-fashion-trends,,,,,
Fashion Trends,Ready to skip winter? These are all the summer 2022 trends to look forward to according to Copenhagen Fashion Week,Your first look at SS22.,https://www.glamourmagazine.co.uk/gallery/copenhagen-fashion-week-trends-ss22,Charlie Teather ,https://media.glamourmagazine.co.uk/photos/61389b36236c41e8314899c6/4:3/w_1600%2Cc_limit/sqjpg.jpg,,,
,5 Spring 2022 Trends You Probably Already Have in Your Closet,,https://www.instyle.com/fashion/clothing/spring-2022-fashion-trends,,https://imagesvc.meredithcorp.io/v3/mm/image?url=https%3A%2F%2Fimagesvc.meredithcorp.io%2Fv3%2Fmm%2Fimage%3Furl%3Dhttps%253A%252F%252Fstatic.onecms.io%252Fwp-content%252Fuploads%252Fsites%252F14%252F2021%252F10%252F18%252F101821-spring-trends-in-closet-lead-2000.jpg&w=426&h=285&c=sc&poi=%5B1020%2C586%5D&q=85&rect=0%2C0%2C2000%2C1333,,,
,10 trends that define the Spring 2022 season,,https://www.vogue.in/fashion/content/10-trends-that-define-the-spring-2022-season,Steff Yotka,https://assets.vogue.in/photos/616e854e5b1891a27019ac41/1:1/w_1600%2Cc_limit/00_promo.jpg,,21 October 2021,
Designer Fashion,"The biggest fashion trends you need to know about for 2022, from 'goddess dressing' to the return of bodycon","The resort collections are a sneak peek into next year, right now",https://www.glamourmagazine.co.uk/article/resort-2022-fashion-trends,Alexandra Fullerton ,https://media.glamourmagazine.co.uk/photos/6138a1cfdc58bfe816d3990f/4:3/w_1600%2Cc_limit/cruise.jpg,,,
,"These Will Be the Only 9 Trends You’ll Want to Buy in 2022, According to a Fashion Editor",,https://www.purewow.com/fashion/2022-fashion-trend-predictions,,"https://purewows3.imgix.net/images/articles/2021_11/2022_trend_predictions_400.jpg?auto=format,compress&cs=strip&fit=min&w=400&h=290",GETTY IMAGES / MONROE STEELE,,
,"From egg shell heels to demon basketball bags, the 9 wildest accessories of spring/summer 2022",,https://www.vogue.in/fashion/gallery/from-egg-shell-heels-to-demon-basketball-bags-the-9-wildest-accessories-of-spring-summer-2022,Vogue,https://assets.vogue.in/photos/615f21f25c25eba05fcaf383/1:1/w_1600%2Cc_limit/trends22.png,,12 October 2021,
,Watch the Dior ready-to-wear Spring/Summer 2022  show live here,,https://www.vogue.in/fashion/content/watch-the-dior-ready-to-wear-springsummer-2022-show-live-here,Akanksha Kamath    Esha Gupta,https://assets.vogue.in/photos/615409bbaf5ef00a6269774f/1:1/w_1600%2Cc_limit/DIOR_SS22_RUNWAY%2520LOOK_69.jpg,,28 September 2021,
Fashion Trends,12 epic summer fashion trends to see you through the (apparent!) incoming September heatwave,Is it too late to be hoping for a summer miracle?,https://www.glamourmagazine.co.uk/gallery/spring-summer-2021-fashion-trends,Charlie Teather ,https://media.glamourmagazine.co.uk/photos/61389012f5e39d30c69b2ff2/4:3/w_1600%2Cc_limit/gettyimages-1277583507_sq.png,,,
,Butt-Protecting Fashion Is the Spring Trend We Didn't See Coming,,https://www.instyle.com/fashion/clothing/butt-protecting-fashion-miniskirt-train-trend,,,,,
London Fashion Week,5 trends from London Fashion Week that we'll all be wearing next spring and beyond,Anyone else fancy fast-forwarding to next summer?,https://www.glamourmagazine.co.uk/gallery/london-fashion-week-spring-summer-2021-fashion-trends,Annabelle Spranklen ,https://media.glamourmagazine.co.uk/photos/613897c93335302f7261ae72/4:3/w_1600%2Cc_limit/untitled-1_sf.jpg,,,
,The Top 7 Winter Fashion Trends to Know Going Into 2022,,https://www.purewow.com/fashion/winter-fashion-trends,,"https://purewows3.imgix.net/images/articles/2021_12/winter_fashion_trends_400.jpg?auto=format,compress&cs=strip",GETTY IMAGES,,
,This Year’s Spring Fashion Trends to Upgrade Your Wardrobe Now and Pay For Later,,https://www.purewow.com/fashion/spring-fashion-trends-affirm,,"https://purewows3.imgix.net/images/articles/2021_03/affirm_spring_trends_category.jpg?auto=format,compress&cs=strip&fit=min&w=400&h=290",ELOQUII,,
,"Mark Our Words, *This* Will Be the Top Fashion Trend of 2022",,https://www.purewow.com/fashion/top-fashion-trend-prediction,,"https://purewows3.imgix.net/images/articles/2021_12/bold_color_trend_2022_CAT.jpg?auto=format,compress&cs=strip",GETTY IMAGES,,
Dresses,Slip dresses are a huge fashion trend for summer but also ideal for layering in the winter – these are our favourites to add to your year-round wardrobe,Fashion's favourite slip dress is fuss-free and fabulous.,https://www.glamourmagazine.co.uk/gallery/best-slip-dresses,Alexandra Fullerton ,https://media.glamourmagazine.co.uk/photos/613895a32b5bbea008291f1d/4:3/w_1600%2Cc_limit/eleanorbarkes_sq.jpg,,,
Fashion Trends,"'Rainbow maximalism' is the fashion trend dominating TikTok, and it could be the secret to faking that summer feeling right now",Because this weather really isn't doing it for us.,https://www.glamourmagazine.co.uk/gallery/rainbow-fashion-trend-tiktok,Hannah Tappin ,https://media.glamourmagazine.co.uk/photos/6138a80d5ebdbf876576baf4/4:3/w_1600%2Cc_limit/nxcva_sq.jpg,,,
Fashion Trends,Milkmaid dresses are the universally flattering fashion trend that will seamlessly take your wardrobe from summer to autumn,Sign. Us. Up.,https://www.glamourmagazine.co.uk/gallery/milkmaid-dresses-fashion-trend,Charlie Teather ,https://media.glamourmagazine.co.uk/photos/6138a98d1145ea59e77e7110/4:3/w_1600%2Cc_limit/claudia_berresford_sq.jpg,,,
,8 high-drama shoes we loved at Couture Fashion Week spring/summer 21,,https://www.vogue.in/fashion/gallery/8-high-drama-shoes-we-loved-at-couture-fashion-week-springsummer-2021,Eni Subair,https://assets.vogue.in/photos/6017b3eba932a492c643a81a/1:1/w_1600%2Cc_limit/00007-Schiaparelli-Couture-Spring-21-credit-Daniel-Roseberry.jpg,,1 February 2021,
Fashion,10 breakout fashion brands we guarantee you'll be seeing everywhere in 2022,Time to get clued up ahead of everyone else.,https://www.glamourmagazine.co.uk/article/fashion-brands-to-know-2022,Charlie Teather ,https://media.glamourmagazine.co.uk/photos/61b9ae59983121fb0be869b8/4:3/w_1600%2Cc_limit/BREAKOUTFASHION151221_DEFAULT.jpg,,,
,"8 Fashion Trends, from Clogs to Corset Tops, that Will Be Huge This Summer",,https://www.purewow.com/fashion/summer-fashion-trends,,"https://purewows3.imgix.net/images/articles/2021_05/summer_trends_cat.png?auto=format,compress&cs=strip&fit=min&w=400&h=290",CHRISTIAN VIERIG; DANIEL ZUCHNIK/GETTY IMAGES,,
,These Are The '80s Fashion Trends Stylists Say Will Be Everywhere in 2022,,https://www.instyle.com/fashion/clothing/80s-fashion,,,,,
,Rom-com dressing is the spring/summer 21 micro-trend that’s arrived just in time for valentine’s day,,https://www.vogue.in/fashion/gallery/rom-com-dressing-is-the-springsummer-21-micro-trend-thats-arrived-just-in-time-for-valentine-day,Naomi Pike,https://assets.vogue.in/photos/6020e218110c3c0cec1092be/1:1/w_1600%2Cc_limit/MissVromcom.jpg,,8 February 2021,
,You Can Easily Recreate This Spring '22 Trend Using the Clothes in Your Closet,,https://www.instyle.com/fashion/clothing/colorblocking-trend-spring-2022,,,,,
,Fashion's Biggest Spring Trend Is Also Its Most Literal,,https://www.instyle.com/fashion/clothing/egg-fashion-trend,,,,,
,8 Major Summer Fashion Trends That Are Already in Your Closet,,https://www.instyle.com/fashion/clothing/best-summer-2021-fashion-trends-in-your-closet,,,,,
,Top 10 Future Of Fashion Trends Reshaping The Industry (In 2022),,https://thevou.com/fashion/future-of-fashion/,Bruce Knox,https://thevou.com/wp-content/uploads/2018/11/WTVOX-future-of-fashion.jpg,,22 November 2021,https://thevou.com/author/techwise/
,Meet the 10 breakout models of Spring 2022,,https://www.vogue.in/fashion/gallery/meet-the-10-breakout-models-of-spring-2022,Janelle Okwodu,https://assets.vogue.in/photos/61727e878b7f5b733c9afa6e/1:1/w_1600%2Cc_limit/100_story.jpg,,31 October 2021,
,These 11 Fashion Trends Are Going Viral This Summer - But They're Actually From the '70s,,https://www.instyle.com/fashion/clothing/70s-summer-fashion-trends,,,,,
,Egyptian Clothing 2022 – BEST Egyptian Fashion Designers and Trends,,https://thevou.com/fashion/egyptian-clothing/,Mandy Meyer,https://thevou.com/wp-content/uploads/2020/11/Egyptian-fashion-and-clothing-wtvox.com-feature-00.jpg,,23 October 2021,https://thevou.com/author/mmeyer/
Weddings,Wedding dress trends to expect in 2022 - from ethereal Princess silhouettes to dramatic sleeves and capes,Weddings are back in a big way.,https://www.glamourmagazine.co.uk/article/bridal-trends-2022,Bianca London ,https://media.glamourmagazine.co.uk/photos/6138a7063bf019dd156880a8/4:3/w_1600%2Cc_limit/bridal.jpg,,,
,There's a Reason This Popular Spring Dress Trend Looks So Familiar,,https://www.instyle.com/fashion/clothing/empire-waist-dress-trend,,,,,
Shopping,This is the little-known brand our Fashion Editor can't stop wearing and it will be all over Instagram this summer,Chic and sustainable? Swoon.,https://www.glamourmagazine.co.uk/gallery/paper-london-sustainable-summer-fashion,Charlie Teather ,https://media.glamourmagazine.co.uk/photos/61389216e2e190b1f7b26096/4:3/w_1600%2Cc_limit/hero_default.jpg,,,
Style Solutions,Forgotten how to dress? These 25 Fashion Editor-approved summer dresses are the simplest additions for a chic post-lockdown wardrobe,Stuck in those tracksuit bottoms?,https://www.glamourmagazine.co.uk/gallery/what-to-wear-after-lockdown,Charlie Teather ,https://media.glamourmagazine.co.uk/photos/6138a6bbba092ab636a113ff/4:3/w_1600%2Cc_limit/img_3567_2_sq.jpg,,,
,32 Best Sustainable Clothing Brands TRENDY For All Body Sizes & Budgets (2022),,https://thevou.com/fashion/sustainable-clothing/,Mandy Meyer,https://thevou.com/wp-content/uploads/2021/06/Sustainable-Clothing-thevou.com-Feature-01.jpg,,19 December 2021,https://thevou.com/author/mmeyer/
Fashion Trends,The fashion pack are ripping up the colour clashing rulebook – these are the bold (and surprising) new ways to wear colour this summer,We bet you’ll have never thought of these 10 clever and unexpected combos,https://www.glamourmagazine.co.uk/article/new-colour-clash-rules,Alexandra Fullerton ,https://media.glamourmagazine.co.uk/photos/6138a8f92677a6ca5ae35116/4:3/w_1600%2Cc_limit/tamumcpherson-_sq.jpg,,,
Sustainability,The jelly shoe may be this summer’s hottest footwear trend – but it’s one of the least environmentally friendly,It's a step backwards.,https://www.glamourmagazine.co.uk/article/jelly-shoe-bad-for-environment,Luciana Bellini ,https://media.glamourmagazine.co.uk/photos/61389545aa3b5acf3b0dbc03/4:3/w_1600%2Cc_limit/gettyimages-829254852_sf_sq.jpg,,,
Fashion Trends,Get ready: Crop tops are the fashion find which will make all your outfits look so summery,And we found 19 of ‘em to inspire your styling options…,https://www.glamourmagazine.co.uk/gallery/best-crop-tops,Alexandra Fullerton ,https://media.glamourmagazine.co.uk/photos/6138a7e92b5bbea008292a68/4:3/w_1600%2Cc_limit/croptopshpa.jpg,,,
,"13 Fall Dress Trends That Actually Work For Summer, Too",,https://www.instyle.com/fashion/clothing/fall-dresses-2021,,,,,
High-Street,16 Fashion Editor-approved pieces from the EPIC Marks & Spencer summer sale,So many great dresses.,https://www.glamourmagazine.co.uk/gallery/marks-and-spencer-sale,Charlie Teather ,https://media.glamourmagazine.co.uk/photos/6138abe0d22f06d735f77a63/4:3/w_1600%2Cc_limit/untitled-1_sq.jpg,,,
,Watch Louis Vuitton's Cruise 2022 show live here,,https://www.vogue.in/fashion/content/watch-louis-vuitton-cruise-2022-show-live-here,Shloka Mehta,https://assets.vogue.in/photos/60c8857a50d94868c7b9d1ee/1:1/w_1600%2Cc_limit/200288449_301367381668596_8416896793540041636_n.jpg,,15 June 2021,
High-Street,Our Fashion Editor's pick of the 16 best pieces from Zara's epic new summer collection,Tired of your tracksuits?,https://www.glamourmagazine.co.uk/gallery/zara-summer-2021-collection,Charlie Teather ,https://media.glamourmagazine.co.uk/photos/6138a84e2b5bbea008292a9c/4:3/w_1600%2Cc_limit/zara.jpg,,,
,5 Easy Spring Trends That Are Already in Your Closet,,https://www.instyle.com/fashion/clothing/easy-spring-trends-you-already-own,,,,,
,"A Fashion Editor’s Picks For the Best Spring Fashion (BTW, It’s All On Sale)",,https://www.purewow.com/fashion/editors-spring-picks-email,,"https://purewows3.imgix.net/images/articles/2021_03/CAT_728x524__12_1.jpg?auto=format,compress&cs=strip&fit=min&w=400&h=290",VICTORIA BELLAFIORE,,
,Balletcore Is Definitely the Prettiest Spring Trend (and It’s Surprisingly Wearable),,https://www.purewow.com/fashion/balletcore-trend,,"https://purewows3.imgix.net/images/articles/2021_03/balletcore_400.png?auto=format,compress&cs=strip&fit=min&w=400&h=290",GETTY IMAGES,,
,"Gen Z Just Turned This Confusing, Ugly '90s Trend Into Summer's Hottest Item",,https://www.instyle.com/fashion/clothing/skort-fashion-trend-outfit-ideas,,,,,
Inthefrow,GLAMOUR's fashion columnist Inthefrow reveals how to pack the ultimate summer capsule wardrobe,Your holiday wardrobe sorted.,https://www.glamourmagazine.co.uk/article/in-the-frow-victoria-magrath-capsule-holiday-wardrobe-glamour-column,Victoria from Inthefrow ,https://media.glamourmagazine.co.uk/photos/6138cbb3f5e39d30c69b5a3f/4:3/w_1600%2Cc_limit/7-02_hero.jpg,,,
Fashion Trends,"The major shoe trends (and 30 best pairs!) to know about this summer, from padded flip flops to clogs and platforms",Comfort is key this summer...,https://www.glamourmagazine.co.uk/gallery/spring-summer-2021-shoe-trends,Charlie Teather ,https://media.glamourmagazine.co.uk/photos/6138ab1ee2e190b1f7b2704d/4:3/w_1600%2Cc_limit/6.jpg,,,
Fashion Trends,This is the surprising trend you'll see all over Instagram this spring,Fashion week's street style set are all over it.,https://www.glamourmagazine.co.uk/gallery/snakeskin-print-fashion-trend,Charlie Teather ,https://media.glamourmagazine.co.uk/photos/61388ea14501b1fdc56b9e00/4:3/w_1600%2Cc_limit/gettyimages-1127082435_sq.jpg,,,
Sustainability,They're the opposite of fast fashion – these are the made-to-order fashion brands you're going to be seeing everywhere this summer,The perfect slow fashion solution.,https://www.glamourmagazine.co.uk/article/made-to-order-fashion,Alexandra Fullerton ,https://media.glamourmagazine.co.uk/photos/6138a7dba35312eec2783fd7/4:3/w_1600%2Cc_limit/molbythelabel_sq.jpg,,,
,Arabic Clothing in 2022 – Top 10 Online Stores & Islamic Fashion Guide,,https://thevou.com/fashion/arabic-clothing/,Mandy Meyer,https://thevou.com/wp-content/uploads/2021/01/Arabic-Clothing-wtvox-feature-2021-02-1.jpg,,27 October 2021,https://thevou.com/author/mmeyer/
,The Top Color Trends to Mix and Match This Summer,,https://www.purewow.com/fashion/summer-color-trends,,"https://purewows3.imgix.net/images/articles/2021_05/summer_color_trends_400.jpg?auto=format,compress&cs=strip&fit=min&w=400&h=290",EDWARD BERTHELOT/GETTY IMAGES,,
Fashion Trends,We found 21 amazing towelling fashion buys that will make you look summery - but still keep you cosy in this damn weather,"Quirky, retro, practical and fun - towelling is the solution for every style situation.",https://www.glamourmagazine.co.uk/gallery/towelling-trend,Alexandra Fullerton ,https://media.glamourmagazine.co.uk/photos/61389ac6a8f6b78280dd7493/4:3/w_1600%2Cc_limit/heartzeena_sq.jpg,,,
,Summer's Hottest Swimsuit Trend Looks Fancy and Expensive — But It's Not,,https://www.instyle.com/fashion/clothing/lurex-swimwear-fashion-trend,,,,,
,We're Finally Giving Into the Cute But Confusing Summer Knits Trend,,https://www.instyle.com/fashion/clothing/summer-knitwear-trend,,,,,
High-Street,16 pieces in the & Other Stories summer sale that our Fashion Editor is adding to her basket,Is anyone not going wild for online shopping right now?,https://www.glamourmagazine.co.uk/gallery/and-other-stories-summer-sale,Charlie Teather ,https://media.glamourmagazine.co.uk/photos/61389fb69734ef64a15eef1e/4:3/w_1600%2Cc_limit/untitled-1_sf.jpg,,,
,30 Best Fashion Movies Of All Time (2022 Update),,https://thevou.com/fashion/best-fashion-movies/,Katherine Saxon,https://thevou.com/wp-content/uploads/2020/03/Top-20-Best-Fashion-Movies-Of-All-Times-wtvox.com-00.jpg,,7 December 2021,https://thevou.com/author/kathe-saxon/
,20 Pairs of Trendy Square Toe Sandals to Stock Up On for Summer,,https://www.purewow.com/fashion/square-toe-sandals,,"https://purewows3.imgix.net/images/articles/2021_07/reformation-sandals_square_toe_sandals.jpg?auto=format,compress&cs=strip&fit=min&w=400&h=290",REFORMATION,,
Swimwear,'Basic swimwear' is this summer's hottest influencer trend,The rise of the print-less bikini.,https://www.glamourmagazine.co.uk/article/plain-swimwear-bikini-swimsuit,Charlie Teather ,https://media.glamourmagazine.co.uk/photos/61388fe69734ef64a15ee495/4:3/w_1600%2Cc_limit/screen.jpg,,,
Books,An exposé of the dark underbelly of the fashion industry in an era of #TimesUp and #MeToo is guaranteed to be your summer read,A must-read.,https://www.glamourmagazine.co.uk/article/juno-dawson-meat-market-extract,Bianca London ,https://media.glamourmagazine.co.uk/photos/61388dae30654311017f637b/4:3/w_1600%2Cc_limit/gettyimages-699159973_sq.jpg,,,
,"Pick a Favorite Shoulder, Because Asymmetrical Styles Are Everywhere for Spring '22",,https://www.instyle.com/fashion/clothing/one-shoulder-trend-spring-2022,,,,,
,On-Trend Essentials You Need for That Last Summer Vacation (That You Can Pay for Over Time With Affirm),,https://www.purewow.com/fashion/summer-vacation-packing-essentials,,"https://purewows3.imgix.net/images/articles/2021_07/affirm_influencer_cat.jpg?auto=format,compress&cs=strip&fit=min&w=400&h=290",KRYSTALYN LAURA/SOFIA KRAUSHAAR,,
Shopping,"Fashion editors are obsessed with this romantic, boho dress label this summer",We. Want. Everything.,https://www.glamourmagazine.co.uk/gallery/love-shack-fancy-dresses,Charlie Teather ,https://media.glamourmagazine.co.uk/photos/61388e93ba092ab636a10431/4:3/w_1600%2Cc_limit/190217_lsf_shot26_3845_sq.jpg,,,
,The Most Divisive Trend of the Summer Is This Tarzan-Like String Bikini Bottom,,https://www.instyle.com/fashion/clothing/side-tie-string-bikini-bottom-trend,,,,,
Fashion,These are all the winners from last night's Fashion Awards in London (you'll be hearing these names a lot in 2022!),It's the most major awards ceremony on the fashion calendar.,https://www.glamourmagazine.co.uk/article/fashion-awards-nominees-winners,Charlie Teather ,https://media.glamourmagazine.co.uk/photos/61a61a1fe64afe64b6482a81/4:3/w_1600%2Cc_limit/FASHIONAWARDSWINNERS_11302021_GettyImages-1356256753_SQ.jpg,,,
,"Chunky Sandals, Chain Details and 4 Other Spring Shoe Trends We Can’t Get Enough Of",,https://www.purewow.com/fashion/spring-shoe-trends,,"https://purewows3.imgix.net/images/articles/2021_03/spring_shoe_trends_400.png?auto=format,compress&cs=strip&fit=min&w=400&h=290",JESSIE LOEFFLER RANDALL / MONROE STEELE / GETTY IMAGES,,
,The Surprising Menswear Trend Taking Over Women’s Closets This Summer,,https://www.purewow.com/fashion/menswear-boxer-short-summer-trend,,"https://purewows3.imgix.net/images/articles/2021_06/menswear-boxer-short-summer-trend.jpg?auto=format,compress&cs=strip&fit=min&w=400&h=290",J.CREW,,
Love Island,Searches for this summer trend are up 313% thanks to Love Island,Shine bright.,https://www.glamourmagazine.co.uk/article/neon-bikini-uk-trend,Oriana Findlay ,https://media.glamourmagazine.co.uk/photos/613893173bf019dd15687428/4:3/w_1600%2Cc_limit/imhannahwhiting_sf.jpg,,,
,"I'm a Fashion Editor, and These Are the 17 Spring Dresses in My Cart Right Now",,https://www.instyle.com/fashion/clothing/spring-dresses,,,,,
Shopping,"Of the 3,807 items in the H&M spring sale, these are the 14 our Fashion Editor thinks you should snap up pronto",Post-lockdown wardrobe need a little refresh?,https://www.glamourmagazine.co.uk/gallery/hm-spring-sale,Charlie Teather ,https://media.glamourmagazine.co.uk/photos/6138a7a34c8f4b78b7c636f2/4:3/w_1600%2Cc_limit/best.jpg,,,
,Apparently We’ll Be “Revenge Shopping” This Spring & Summer—So Get Ready to Drop Some Serious Cash,,https://www.purewow.com/fashion/revenge-shopping-list,,"https://purewows3.imgix.net/images/articles/2021_04/revenge_shopping_gg.jpg?auto=format,compress&cs=strip&fit=min&w=400&h=290",JAMES DEVANEY/GETTY IMAGES,,
,The Summer-3 Fashion Rule Is the Easy Yet Smart Outfit Trick You Have to Try,,https://www.instyle.com/fashion/clothing/the-summer-3-fashion-rule-is-the-seasons-best-outfit-idea,,,,,
,Dark Academia Fashion EXPLAINED In 2022 (+ 30 Brands & Aesthetic Outfits),,https://thevou.com/fashion/dark-academia-fashion/,Katherine Saxon,https://thevou.com/wp-content/uploads/2020/08/Dark-Academia-Fashion-wtvox.com-00.jpg,,13 January 2021,https://thevou.com/author/kathe-saxon/
Shopping,The 'bra accentuation trend' is the racy look to embrace this spring,The season just got racier.,https://www.glamourmagazine.co.uk/gallery/bra-accentuation-trend-ss20,Sophie Cockett ,https://media.glamourmagazine.co.uk/photos/61389b3d54a5dc97887e8676/4:3/w_1600%2Cc_limit/gettyimages-1175094047_sq_sq.jpg,,,
Fashion,This is the £34 sell-out summer dress from Amazon Fashion that's all over your Instagram feed,Adored by influencers? We're gonna need it ASAP.,https://www.glamourmagazine.co.uk/gallery/amazon-fashion-summer-dress,Georgia Trodd ,https://media.glamourmagazine.co.uk/photos/6138a0233bf019dd15687cbb/4:3/w_1600%2Cc_limit/monikh_x_amazon_sq.jpg,,,
Designer Fashion,These are the designer items global fashion influencers can't get enough of this summer,Looking for a seasonal sartorial splurge?,https://www.glamourmagazine.co.uk/article/net-a-porter-global-trends,Charlie Teather ,https://media.glamourmagazine.co.uk/photos/6138a8028cb9467036e0f28d/4:3/w_1600%2Cc_limit/sq.jpg,,,
,12 Fashion Staples to Grab Now That Summer Is Ending,,https://www.purewow.com/fashion/fashion-staples-saturday-shoppable-sept-11-2021,,"https://purewows3.imgix.net/images/articles/2021_09/preview-gallery-CAT_728x524-21.jpg?auto=format,compress&cs=strip&fit=min&w=400&h=290",,,
,“I want to emphasise the beauty of the country”: Maria Grazia Chiuri on hosting Dior’s Cruise 2022 collection in Athens,,https://www.vogue.in/fashion/content/i-want-to-emphasise-the-beauty-of-the-country-maria-grazia-chiuri-on-hosting-diors-cruise-2022-collection-in-athens,Elis Kiss,https://assets.vogue.in/photos/60cc47404fba32b9b63fd5c3/1:1/w_1600%2Cc_limit/Credit_Dionisis%2520Andrianopoulos.jpg,,18 June 2021,
Shopping,Short wedding dresses are trending so here are 21 of the best picks for your summer wedding,Perfect for the modern bride.,https://www.glamourmagazine.co.uk/gallery/short-wedding-dresses,Georgia Trodd ,https://media.glamourmagazine.co.uk/photos/61388ed530654311017f647e/4:3/w_1600%2Cc_limit/short.jpg,,,
,Here are the seven finalists competing for the 2022 International Woolmark Prize,,https://www.vogue.in/fashion/content/here-are-the-seven-finalists-competing-for-the-2022-international-woolmark-prize,Chloe Chou,https://assets.vogue.in/photos/619e15abc333178759b27df1/1:1/w_1600%2Cc_limit/IWP2022_GROUP_3_NOLOGO_1080X1920.jpg,,24 November 2021,
Fashion,"These 14 trends will be *everywhere* next season, according to the hottest fashion week catwalks",Done with winter already? Here's what next spring will look like.,https://www.glamourmagazine.co.uk/gallery/spring-summer-2022-fashion-trends,Charlie Teather ,https://media.glamourmagazine.co.uk/photos/6155d6b7f59e45f835394d87/4:3/w_1600%2Cc_limit/SS22TRENDS_300921_Hero_Default-2_SQ.jpg,,,
Fashion Trends,This is summer’s sexiest trend and everybody can wear it,June 21st is coming in hot.,https://www.glamourmagazine.co.uk/article/sexy-fashion-trend,Alexandra Fullerton ,https://media.glamourmagazine.co.uk/photos/613890b02b5bbea008291b6b/4:3/w_1600%2Cc_limit/bringing.jpg,,,
Shopping,M&S just launched a seriously beautiful summer dress collection with fashion-favourite label Ghost,"Fans of floral prints, head this way...",https://www.glamourmagazine.co.uk/gallery/ms-ghost-june-2021-collection,Charlie Teather ,https://media.glamourmagazine.co.uk/photos/613891ea2bec5fcec32c10cc/4:3/w_1600%2Cc_limit/01332_shot13_165_digital_sq.jpg,,,
,Why Is Mom and Dad Fashion So in Right Now? We Talked to Therapists and Trend Forecasters to Find Out,,https://www.purewow.com/fashion/mom-and-dad-fashion-trends,,"https://purewows3.imgix.net/images/articles/2021_05/mom_and_dad_fashion_CAT.jpg?auto=format,compress&cs=strip&fit=min&w=400&h=290",KAITLYN COLLINS,,
Designer Fashion,15 new season fashion campaigns that have got us craving summer,The perfect cure for winter blues...,https://www.glamourmagazine.co.uk/gallery/best-fashion-campaigns,Charlie Teather ,https://media.glamourmagazine.co.uk/photos/61388dc31145ea59e77e5fa7/4:3/w_1600%2Cc_limit/giorgio_armani_ss19__kurt_markus_4.jpg,,,
Fashion Trends,Zebra print trousers are a major trend for Spring so here’s how to style them (and it's not as scary as you might think!),Zebra print trousers are super versatile and totally on-trend.,https://www.glamourmagazine.co.uk/gallery/zebra-print-trousers,Alexandra Fullerton ,https://media.glamourmagazine.co.uk/photos/6138a7d7f5e39d30c69b3ee5/4:3/w_1600%2Cc_limit/oliviaandalice_sq.jpg,,,
,I’m a Fashion Editor & Here’s What I’m Buying This Spring,,https://www.purewow.com/fashion/fashion-editor-spring-shopping-list,,"https://purewows3.imgix.net/images/articles/2021_03/fashion_editor_spring_shopping_list.jpg?auto=format,compress&cs=strip&fit=min&w=400&h=290",VICTORIA BELLAFIORE,,
,"Pantone’s 2022 Colour of the Year, Very Peri, embraces strangeness",,https://www.vogue.in/fashion/content/pantones-2022-colour-of-the-year-very-peri-embraces-strangeness,Steff Yotka,https://assets.vogue.in/photos/61b45ef8310967f8c82b14f0/1:1/w_1600%2Cc_limit/00008-Valentino-Couture-Fall-21-credit-Filippo-Fior-GoRunway.jpg,,11 December 2021,
