Blog Title,Blog Link,Thumbnail Link
What 12 of Your Favorite Fitness People Are Wearing for Their Winter Workouts,https://www.instyle.com/fashion/clothing/workout-clothes-fitness-favorites,https://imagesvc.meredithcorp.io/v3/mm/image?url=https%3A%2F%2Fimagesvc.meredithcorp.io%2Fv3%2Fmm%2Fimage%3Furl%3Dhttps%253A%252F%252Fstatic.onecms.io%252Fwp-content%252Fuploads%252Fsites%252F14%252F2021%252F12%252F28%252F122821-Winter-Workout-Outfits-Lead.jpg&w=426&h=285&q=85&c=tc&rect=4%2C2%2C1800%2C1200
The 13 Best Activewear Brands to Shop for 2022,https://www.instyle.com/fashion/clothing/best-activewear-brands,
I Only Wear Workout Clothes for Instagram,https://www.instyle.com/fashion/workout-clothes-instagram-worthy,
5 Plus Size Activewear Brands That Are Truly Size-Inclusive,https://www.instyle.com/fashion/clothing/best-plus-size-fitness-clothes,
"What Do We Even Call ""Athleisure"" Now?",https://www.instyle.com/fashion/athleisure-trends-2022,
2022 Workout Clothes So Cute You'll Want to Go Back to the Gym,https://www.instyle.com/fashion/clothing/workout-clothes-new,
I Haven't Taken Off This Dangerously Soft Loungewear in Days — and Neither Will You,https://www.instyle.com/fashion/clothing/richer-poorer-recycled-fleece-loungewear-review,
The Sad Reason Carrie Is Wearing *Those* Shoes in And Just Like That...'s Most Shocking Scene,https://www.instyle.com/fashion/shoes/and-just-like-that-ep-1-shoes,
Target Shoppers Are Purchasing Multiples of This Best-Selling Mock Turtleneck Sweater — and It's on Sale for $14,https://www.instyle.com/fashion/universal-thread-crewneck-pullover-sweater,
The 12 Best Styling Tricks We've Learned from Emily in Paris' Outfits,https://www.instyle.com/fashion/emily-in-paris-outfits,
This On-the-Rise Red Carpet Brand Just Pivoted to Workout Wear,https://www.instyle.com/fashion/clothing/patbo-fitness-clothes,
"3 Celebrity-Approved, Last-Minute Emergency Gift Ideas You Can Find at American Eagle",https://www.instyle.com/fashion/clothing/holiday-gift-ideas-american-eagle,
10 Stylist-Approved Valentine's Day Outfits For Every Type of Date Night,https://www.instyle.com/holidays-occasions/valentines-day/valentines-day-outfits,
9 Warm (But Not Too Warm) Outfits to Wear on 50-Degree Days,https://www.instyle.com/fashion/clothing/what-to-wear-in-50-degree-weather,
10 Throwback Carrie Bradshaw Outfits That Still Work for 2022,https://www.instyle.com/fashion/carrie-bradshaw-outfits,
Sadie Sink Just Shared the Most Genius Tip for Winterizing Your Whole Wardrobe,https://www.instyle.com/fashion/clothing/sadie-sink-winter-fashion-interview,
"Amazon Shoppers Receive ""So Many Compliments"" While Wearing This Best-Selling Cocktail Dress — and It's $35",https://www.instyle.com/fashion/prettygarden-tie-waist-cocktail-dress-amazon,
Katie Holmes Keeps Starting Trends by Accident,https://www.instyle.com/celebrity/katie-holmes/katie-holmes-fashion-trends-interview,
11 Incredibly Cute Knee-High Boots Outfits to Keep in Your Rotation,https://www.instyle.com/fashion/clothing/knee-high-boots-outfits,
13 Clothing Stores You Remember If You Grew Up During Y2K,https://www.instyle.com/fashion/clothing/y2k-clothing-stores,
The Muppet Hat Trend Is the Latest Outrageous '90s Revival,https://www.instyle.com/fashion/accessories/fuzzy-hat-trend,
These Are The '80s Fashion Trends Stylists Say Will Be Everywhere in 2022,https://www.instyle.com/fashion/clothing/80s-fashion,
"""Jellyfishing"" Is the New Lampshading: Here's How to Master Winter's Weird Silhouette Trend",https://www.instyle.com/fashion/clothing/jellyfishing-oversized-top-coat-trend,
"Tapered Puff Sleeves Are the Easy, Romantic Fashion Trend That Will Make You Feel Like Royalty",https://www.instyle.com/fashion/clothing/tapered-puff-sleeves-fashion-trend,
9 Ugg Outfits That Prove Those Boots and Slides Are Way More Versatile Than You Thought,https://www.instyle.com/fashion/clothing/ugg-outfits,
"If You're Unsure What to Wear for the Holidays, Start With These 11 Stylist-Approved Outfit Ideas",https://www.instyle.com/fashion/clothing/holiday-outfits-stylist-ideas,https://imagesvc.meredithcorp.io/v3/mm/image?url=https%3A%2F%2Fimagesvc.meredithcorp.io%2Fv3%2Fmm%2Fimage%3Furl%3Dhttps%253A%252F%252Fstatic.onecms.io%252Fwp-content%252Fuploads%252Fsites%252F14%252F2021%252F12%252F01%252Fholiday-looks-lead-2000.jpg&w=426&h=285&q=85&c=tc&rect=200%2C103%2C1800%2C1170
12 Borderline Cheesy (But Super Fun) Novelty Items I Need for My Wedding,https://www.instyle.com/fashion/clothing/novelty-wedding-accessories,https://imagesvc.meredithcorp.io/v3/mm/image?url=https%3A%2F%2Fimagesvc.meredithcorp.io%2Fv3%2Fmm%2Fimage%3Furl%3Dhttps%253A%252F%252Fstatic.onecms.io%252Fwp-content%252Fuploads%252Fsites%252F14%252F2021%252F11%252F15%252F111521-novelty-bride-wedding-items-lead-2000.jpg&w=426&h=285&c=sc&poi=%5B1000%2C453%5D&q=85&rect=0%2C0%2C2000%2C1333
"14 Shackets That Are So Cute and Cozy, You'll Wonder How You Ever Lived Without Them",https://www.instyle.com/fashion/clothing/what-is-a-shacket,
"Behold, the 9 Fabulous Fall Outfits Emily Ratajkowski Wore to Promote Her Book This Week",https://www.instyle.com/celebrity/emily-ratajkowski/emily-ratajkowski-fall-outfits,
"How to Wear Dresses in the Winter, According to 5 Fashion Experts",https://www.instyle.com/fashion/clothing/how-to-wear-dresses-in-the-winter,
21 Holiday Sweaters That Will Transform Your Jeans Into a Whole Festive Outfit,https://www.instyle.com/fashion/clothing/cute-holiday-sweaters,
This Gen Z Dress Trend Just Solved Every Single One of My Fashion Dilemmas,https://www.instyle.com/fashion/clothing/mesh-dress-trend,
I Wore This Instagram-Famous Sweater and I've Never Gotten So Many Compliments,https://www.instyle.com/fashion/clothing/myracle-cardigan-review,
"Well, It Looks Like Cerulean Is Making a Comeback",https://www.instyle.com/fashion/clothing/cerulean-color-trend,
15 Outfits to Wear to Every Holiday Celebration on Your Calendar,https://www.instyle.com/fashion/clothing/holiday-outfit-ideas,
5 Facts You Probably Didn't Know About Last Night in Soho's Gorgeous Costumes,https://www.instyle.com/fashion/clothing/last-night-in-soho-costumes,
6 Places to Donate Clothes to This Holiday Season,https://www.instyle.com/fashion/clothing/where-to-donate-clothes,
Metamorphosis Fashion Is the New Trend That Will Actually Save You Money,https://www.instyle.com/fashion/clothing/metamorphosis-fashion-convertible-clothing,
"Spanx's New Breathable Loungewear Is So Soft, I Feel Like I'm Wearing a Fluffy Cloud",https://www.instyle.com/fashion/clothing/spanx-airluxe-collection-review,
The History of the Corset Is a Controversial One,https://www.instyle.com/fashion/clothing/history-of-the-corset,
"Don't Worry, Models Say It's Still Cool to Wear All Black in Fall",https://www.instyle.com/fashion/clothing/celebrity-black-outfit-ideas,
A Tribute to Sandra Bullock's Coziest Movie Sweaters,https://www.instyle.com/fashion/clothing/sandra-bullock-character-sweaters,
"It's Been 20 Years, But I'm Still Thinking About Rochelle From The Craft's Perfect '90s Dress",https://www.instyle.com/fashion/clothing/rochelle-the-craft-outfits,
8 Winter Outfits Professional Stylists Can't Wait to Put Together This Season,https://www.instyle.com/fashion/clothing/winter-outfit-ideas,
10 Denim on Denim Outfits to Try Tomorrow,https://www.instyle.com/fashion/clothing/denim-on-denim-outfits,
"Finally, a Fashion Trend for Literary Nerds",https://www.instyle.com/fashion/clothing/dark-academia-trend,
I Can't Stop Buying Back My Childhood Wardrobe,https://www.instyle.com/fashion/clothing/buying-back-2000s-fashion,
Why 30-Somethings Are the Real Winners of the Y2K Comeback,https://www.instyle.com/fashion/clothing/2000s-fashion-trends-over-30,
"From Work to Date Night, Amazon Shoppers Can't Stop Wearing This Feminine Blazer — and It's Under $50",https://www.instyle.com/fashion/cicy-bell-casual-blazer-amazon,
"I'm a Fashion Editor, and These 11 Trends Are the Secret to All My Fall Outfits",https://www.instyle.com/fashion/clothing/fall-winter-trends-2021-fashion-editor,
5 Spring 2022 Trends You Probably Already Have in Your Closet,https://www.instyle.com/fashion/clothing/spring-2022-fashion-trends,https://imagesvc.meredithcorp.io/v3/mm/image?url=https%3A%2F%2Fimagesvc.meredithcorp.io%2Fv3%2Fmm%2Fimage%3Furl%3Dhttps%253A%252F%252Fstatic.onecms.io%252Fwp-content%252Fuploads%252Fsites%252F14%252F2021%252F10%252F18%252F101821-spring-trends-in-closet-lead-2000.jpg&w=426&h=285&c=sc&poi=%5B1020%2C586%5D&q=85&rect=0%2C0%2C2000%2C1333
18 Festive Halloween T-Shirts and Sweatshirts That Double as Costumes,https://www.instyle.com/holidays-occasions/halloween/halloween-t-shirts-and-sweatshirts,https://imagesvc.meredithcorp.io/v3/mm/image?url=https%3A%2F%2Fimagesvc.meredithcorp.io%2Fv3%2Fmm%2Fimage%3Furl%3Dhttps%253A%252F%252Fstatic.onecms.io%252Fwp-content%252Fuploads%252Fsites%252F14%252F2021%252F10%252F20%252F102021-halloween-shirts-lead-2000.jpg&w=426&h=285&c=sc&poi=%5B980%2C533%5D&q=85&rect=0%2C0%2C2000%2C1333
Why Does No One Ever Talk About Jamie Lee Curtis' Weird White Tights in Halloween?,https://www.instyle.com/fashion/jamie-lee-curtis-halloween-movie-outfit,
15 Ways to Turn the Most Basic Pieces in Your Closet Into a Halloween Costume,https://www.instyle.com/holidays-occasions/halloween/easy-last-minute-halloween-costumes-with-clothes-you-own,
"According to TikTok, It's 'Meg Ryan Fall' — Here Are 6 Outfits to Try ASAP",https://www.instyle.com/fashion/clothing/meg-ryan-fall-outfits,
Megan Fox's New boohoo Collaboration Was Partly Inspired By Machine Gun Kelly,https://www.instyle.com/celebrity/megan-fox/megan-fox-boohoo-collaboration-exclusive,
"Extremely Naked Dresses Are Back, and They're Actually Kind of Romantic This Time",https://www.instyle.com/fashion/clothing/naked-dress-trend-2022,
"Yes, Jean Skirts Are Back — Here Are 7 Fresh Outfits to Try Right Now",https://www.instyle.com/fashion/clothing/jean-skirt-outfits,
Butt-Protecting Fashion Is the Spring Trend We Didn't See Coming,https://www.instyle.com/fashion/clothing/butt-protecting-fashion-miniskirt-train-trend,
9 Grunge Outfits to Recreate This Fall,https://www.instyle.com/fashion/clothing/grunge-outfits,
13 Fun Fall Outfits That Revolve Around a Turtleneck,https://www.instyle.com/fashion/clothing/how-to-wear-turtlenecks,
These Details About the Costumes from Only Murders in the Building Will Change How You Watch the Show,https://www.instyle.com/fashion/clothing/only-murders-in-the-building-costume-designer-interview,
15 Iconic Rachel Green Outfits That Are Somehow Still Perfect for Fall 2021,https://www.instyle.com/fashion/clothing/rachel-green-outfits,
Gabrielle Union Wore the Sexiest and Comfiest-Looking Nap Dress,https://www.instyle.com/celebrity/gabrielle-union/gabrielle-union-sexy-nap-dress,
This Quick Shoe Trick Will Make Your Old Outfits Look Brand New,https://www.instyle.com/fashion/clothing/colorful-boots-fashion-trend,
Dakota Johnson Just Wore the Versatile Pants Trend That's Replacing Jeans,https://www.instyle.com/celebrity/dakota-johnson/dakota-johnson-trouser-pants-trend,
This $0 Styling Trick Will Make Fall Dressing So Easy,https://www.instyle.com/fashion/clothing/easy-layering-styling-trick,
Spanx Just Restocked the Faux Suede Leggings That Sold Out Less Than a Month After Their Debut ,https://www.instyle.com/fashion/spanx-faux-suede-leggings-restock,
9 Celebrities on How They Create the Perfect Fall Outfit,https://www.instyle.com/fashion/clothing/celebrities-on-the-perfect-fall-outfit,
Cutouts Are Getting Even More Daring Next Season,https://www.instyle.com/fashion/clothing/cutouts-trend-2022,
7 Fashion Experts Share Their Predictions for the Top Fashion Trends of 2022,https://www.instyle.com/fashion/clothing/best-2022-fashion-trends,
I'm Almost 30 and My Favorite Jeans Are From the Infamous Mall Brand of My Youth,https://www.instyle.com/fashion/clothing/abercrombie-and-fitch-curve-love-jeans-collection,
"I'm a Fashion Editor, And Here's What I'm Already Wearing From Target's New Designer Collab",https://www.instyle.com/fashion/clothing/target-fall-2021-designer-collection-review,
6 Perfect Fall Outfits to Wear Back to Work,https://www.instyle.com/fashion/clothing/fall-back-to-work-outfits,
8 Outfit Ideas for All the Fall Weddings You're About to Go To,https://www.instyle.com/fashion/clothing/fall-wedding-guest-outfits,
15 Easy Halloween Costume Ideas If You Just Decided You're Going Out,https://www.instyle.com/fashion/clothing/last-minute-halloween-costume-ideas,https://imagesvc.meredithcorp.io/v3/mm/image?url=https%3A%2F%2Fimagesvc.meredithcorp.io%2Fv3%2Fmm%2Fimage%3Furl%3Dhttps%253A%252F%252Fstatic.onecms.io%252Fwp-content%252Fuploads%252Fsites%252F14%252F2021%252F09%252F23%252F092321-easy-halloween-costumes-lead-2000.jpg&w=426&h=285&c=sc&poi=%5B1060%2C273%5D&q=85&rect=538%2C84%2C1618%2C804
Celebrity Stylist Dani Michelle Says This Is the Secret Behind the Viral Paper-Clip Top,https://www.instyle.com/fashion/clothing/celebrity-stylist-dani-michelle-fall-trends-dsw-interview,https://imagesvc.meredithcorp.io/v3/mm/image?url=https%3A%2F%2Fimagesvc.meredithcorp.io%2Fv3%2Fmm%2Fimage%3Furl%3Dhttps%253A%252F%252Fstatic.onecms.io%252Fwp-content%252Fuploads%252Fsites%252F14%252F2021%252F09%252F21%252F092121-dani-michelle-paperclip-top-lead-2000.jpg&w=426&h=285&c=sc&poi=%5B1020%2C479%5D&q=85&rect=0%2C0%2C2000%2C1333
Bella Hadid's Transitional and Chaotic Sweater Has Gloves and Armpit Cutouts,https://www.instyle.com/celebrity/bella-hadid/bella-hadid-armpit-cutout-sweater,
"Shoppers Say THESE Are the Levi's With a ""Perfect Fit""",https://www.instyle.com/fashion/levis-pull-on-jeans-amazon,
You Can Easily Recreate This Spring '22 Trend Using the Clothes in Your Closet,https://www.instyle.com/fashion/clothing/colorblocking-trend-spring-2022,
9 Cute Apple Picking Outfits — Because You Know It's Going on Instagram,https://www.instyle.com/fashion/clothing/fall-outfits-for-apple-picking,
Exclusive: Gabrielle Union's Clothing Line Is Back and Better Than Ever,https://www.instyle.com/celebrity/gabrielle-union/gabrielle-union-collection-clothing-line-fall-2021,
Bella Hadid Channels a Sexy Vampire in a Cutout Dress for Self-Portrait's New Campaign,https://www.instyle.com/celebrity/bella-hadid/bella-hadid-self-portrait-spring-2022,
"Jodie Turner-Smith On Her New COS Campaign, Turtlenecks, and Looking Cute in Sweats",https://www.instyle.com/fashion/clothing/jodi-turner-smith-cos-fall-2021-campaign,
Beanie Feldstein Says She and Sarah Paulson Can't Keep Their Cool Around One Impeachment Costar,https://www.instyle.com/celebrity/beanie-feldstein-impeachment-fashion-interview,
10 Outfit Ideas to Wear to a Football Game,https://www.instyle.com/fashion/clothing/what-to-wear-to-football-game,
"Pick a Favorite Shoulder, Because Asymmetrical Styles Are Everywhere for Spring '22",https://www.instyle.com/fashion/clothing/one-shoulder-trend-spring-2022,
"Chromat's Boundary-Breaking Swimwear Line Is Made for ""Girls Who Don't Tuck""",https://www.instyle.com/awards-events/fashion-week/chromat-trans-inclusive-swimwear,
"I'm a Shopping Writer, and This $40 Jacket Is Easily One of My Favorite Fall Finds",https://www.instyle.com/fashion/clothing/anna-kaci-corduroy-jacket-amazon,
7 Puffer Jacket Outfits That Prove a Coat Can Be the Highlight of Your Look,https://www.instyle.com/fashion/clothing/best-puffer-jacket-outfits,
The New New,https://www.instyle.com/fashion/the-new-new,
"8 Fall Trends You Already Have in Your Closet, and How to Wear Them Right Now",https://www.instyle.com/fashion/clothing/fashion-trends-fall-2021-in-your-closet,
This Dress Makes Me Want to Pay $810 to Essentially Be Naked,https://www.instyle.com/fashion/clothing/louisa-ballou-blue-mesh-hightide-dress,
Celebrities Have Committed to 2021's Most Chaotic Pants Trend,https://www.instyle.com/fashion/clothing/cutout-pants-trend,
Street Style Photos That Prove People Are Ready to Get Dressed Again,https://www.instyle.com/fashion/street-style/nyc-outfit-inspiration-2021,
The Exact Behind-the-Scenes Sorcery That Makes a Look Go Viral on TikTok,https://www.instyle.com/fashion/clothing/tiktok-viral-style-explained,
"We're Not Exaggerating, Every Single Piece From Target's New Designer Collab Is So Freakin' Good",https://www.instyle.com/fashion/every-piece-from-target-fall-2021-designer-collection,
11 Going-Out Outfits to Wear This Weekend,https://www.instyle.com/fashion/clothing/going-out-outfits,
16 Plaid Skirt Outfits You'll Want to Copy ASAP,https://www.instyle.com/fashion/clothing/plaid-skirt-outfits,
"So, We're Back to Wearing Black Dress Pants Everywhere, Huh?",https://www.instyle.com/fashion/clothing/black-dress-pants-trend,
Easy Tricks for Getting Makeup Stains Out of Clothing,https://www.instyle.com/how-tos/how-to-get-makeup-out-of-clothing,https://imagesvc.meredithcorp.io/v3/mm/image?url=https%3A%2F%2Fimagesvc.meredithcorp.io%2Fv3%2Fmm%2Fimage%3Furl%3Dhttps%253A%252F%252Fstatic.onecms.io%252Fwp-content%252Fuploads%252Fsites%252F14%252F2021%252F09%252F01%252F090121_makeup_stains_clothes_lead.jpg&w=426&h=285&q=85&c=tc&rect=0%2C0%2C1800%2C1200
12 Casual-Cute Outfits to Wear to a Baseball Game,https://www.instyle.com/fashion/clothing/what-to-wear-to-baseball-game,https://imagesvc.meredithcorp.io/v3/mm/image?url=https%3A%2F%2Fimagesvc.meredithcorp.io%2Fv3%2Fmm%2Fimage%3Furl%3Dhttps%253A%252F%252Fstatic.onecms.io%252Fwp-content%252Fuploads%252Fsites%252F14%252F2021%252F08%252F31%252F083121_baseball_game_lead-2000.jpg&w=426&h=285&q=85&c=tc&rect=251%2C136%2C1851%2C1202
Good News: Blanket Scarf Season Is (Almost) Here,https://www.instyle.com/fashion/clothing/how-to-wear-a-blanket-scarf,
Swimsuits Are All On Sale Right Now — Here's How to Find the Most Flattering Fits,https://www.instyle.com/fashion/swimsuits-on-sale-most-flattering,
2016's Fringe Fashion Trend Has Returned,https://www.instyle.com/fashion/clothing/fringe-clothing-fall-2021,
"Yes, Vintage Clothing Can Be Haunted — Here's How to Get Rid of That Bad Energy",https://www.instyle.com/fashion/clothing/how-to-cleanse-energy-from-vintage-clothing,
Addison Rae Weighs in On History's Most Questionable Denim Trends,https://www.instyle.com/fashion/clothing/jeans-denim/addison-rae-jeans-trends-video,
Megan Fox's Monochromatic Outfits Secretly Tackle About 6 Trends at Once,https://www.instyle.com/celebrity/megan-fox/megan-fox-monochromatic-outfits,
Gabrielle Union Has Been Pulling These 9 Fashion Tricks For Over 20 Years,https://www.instyle.com/celebrity/gabrielle-union/gabrielle-union-style,
Mummy Outfits Are Popping Up All Over Hollywood,https://www.instyle.com/fashion/clothing/mummy-clothing-trend,
"A Month's Worth of Fall Outfit Ideas, Courtesy of Copenhagen Fashion Week",https://www.instyle.com/fashion/street-style/fall-outfit-ideas-copenhagen-street-style,
13 Easy Halloween Costumes You Can Definitely Wear After October 31,https://www.instyle.com/holidays-occasions/halloween/easy-halloween-costume-ideas,
Can India's Favorite Bridalwear Designer Make an H&M Collection That Lasts Forever?,https://www.instyle.com/fashion/clothing/sabyasachi-hm-collaboration,
Stylist Karla Welch Is Selling Celeb-Worthy Vintage On Poshmark Right Now,https://www.instyle.com/fashion/karla-welch-poshmark-closet-sale,
Bella Hadid Is Undergoing a Chaotic Fashion Transformation,https://www.instyle.com/celebrity/bella-hadid/bella-hadid-fashion-transformation,
"OMG, The Internet's Favorite Nap Dress Just Got a Bridgerton Twist",https://www.instyle.com/fashion/clothing/hill-house-home-bridgerton-nap-dress-collection,
I Tried the Seamless Underwear Boasting a 'Second Skin'' Feel and Was Immediately Hooked,https://www.instyle.com/fashion/clothing/eby-seamless-panties-review,
Why TikTok's Brittany Xavier Is Continuing to Wear Crop Tops and Cutouts While Pregnant (Exclusive),https://www.instyle.com/fashion/clothing/brittany-xavier-pregnancy-fashion-interview,
"Sorry, Sweatsuits — You've Just Been Replaced By The 3-Piece Outfit Trend",https://www.instyle.com/fashion/clothing/three-piece-outfit-trend,
"Target's Next Collab Will Include Nili Lotan, Rachel Comey, Sandy Liang, and Victor Glemaud ",https://www.instyle.com/fashion/target-fall-designer-collection-2021,
"Cropped Cardigans, Knee-High Socks, and 7 More '90s Trends That Will Be Big For Fall",https://www.instyle.com/fashion/clothing/everyday-90s-fashion,
"The Shirt Dress 2.0 Is Here, and It's Actually Better Than the Original",https://www.instyle.com/fashion/clothing/ruched-shirt-dress-trend,
"Billy Porter's 10 Biggest, Boldest, and Best Fashion Moments",https://www.instyle.com/fashion/billy-porter-best-style-moments,
"Angelina Jolie Loves Beige, But These 6 Tricks Ensure Her Outfits Are Never Boring",https://www.instyle.com/celebrity/angelina-jolie/angelina-jolie-beige-outfits,
The New Work Wardrobe Is a Chance to Uncomplicate Your Life,https://www.instyle.com/fashion/clothing/new-work-wardrobe,
The Unironic Return of Millennial Teen Style,https://www.instyle.com/fashion/clothing/y2k-core-millennial-teen-trends,https://imagesvc.meredithcorp.io/v3/mm/image?url=https%3A%2F%2Fimagesvc.meredithcorp.io%2Fv3%2Fmm%2Fimage%3Furl%3Dhttps%253A%252F%252Fstatic.onecms.io%252Fwp-content%252Fuploads%252Fsites%252F14%252F2021%252F07%252F16%252Fmillenial-trends-lead-2000.jpg&w=426&h=285&q=85&c=tc&rect=80%2C110%2C1459%2C1030
9 Classic Pieces That Are Worth a Splurge,https://www.instyle.com/fashion/clothing/classic-pieces-worth-investment,https://imagesvc.meredithcorp.io/v3/mm/image?url=https%3A%2F%2Fimagesvc.meredithcorp.io%2Fv3%2Fmm%2Fimage%3Furl%3Dhttps%253A%252F%252Fstatic.onecms.io%252Fwp-content%252Fuploads%252Fsites%252F14%252F2021%252F07%252F19%252Fsplurge-2000.jpg&w=426&h=285&q=85&c=tc&rect=106%2C32%2C1705%2C1098
"I Bought So Many Dresses for Summer, but This $15 Target Option Is All I Wear",https://www.instyle.com/fashion/clothing/target-summer-dress-a-new-day,
'90s Celebrity Outfits You Can Absolutely Still Wear Today,https://www.instyle.com/fashion/clothing/everyday-90s-fashion-celebrity-outfits,
Is Splatter Paint the New Tie-Dye?,https://www.instyle.com/fashion/clothing/splatter-paint-trend,
Why This One Coat Is Always Worth the Investment,https://www.instyle.com/fashion/clothing/trench-coat-outfit-ideas,
Shopping Hacks Fashion Editors Use to Get the Lowest Price Possible on Expensive Pieces,https://www.instyle.com/fashion/clothing/shopping-hacks-online-discounts,
"I Swear by This Strapless, Backless Bra — and It's Back in Stock at Target",https://www.instyle.com/fashion/clothing/superlite-adhesive-strapless-backless-bra-target,
Andrea Iyamah Created a Bucket Hat That's Magically Also a Drink Cooler,https://www.instyle.com/fashion/accessories/andrea-iyamah-ice-bucket-hat,
How Stylists and Fashion Editors Find Special Designer Pieces No One Else Has,https://www.instyle.com/fashion/clothing/best-online-thrift-stores,
How to Know When to Save or Splurge When Building a Capsule Wardrobe,https://www.instyle.com/fashion/clothing/capsule-wardrobe-shopping-guide,
15 Cute Date Outfit Ideas for Fall,https://www.instyle.com/fashion/clothing/cute-date-outfit-ideas-fall,
How to Style Fashion's Most Controversial Jeans Trend Once and For All,https://www.instyle.com/fashion/clothing/how-to-wear-mom-jeans,
It Looks Like Hailey Bieber Secretly Recreated Some of Jennifer Lopez's Best '00s Outfits,https://www.instyle.com/fashion/clothing/hailey-bieber-wearing-jennifer-lopez-2000s-outfits,
Naomi Osaka Shares Her Off-Duty Favorites,https://www.instyle.com/awards-events/sports/olympics/naomi-osaka-off-duty-style,
Bella Hadid and Beyoncé Both Approve of This Ridiculously Easy $0 Outfit Trick,https://www.instyle.com/fashion/clothing/knotted-shirt-fashion-trick,
Khloé Kardashian Jokes That Kim Copied Her By Releasing a Neon Collection,https://www.instyle.com/fashion/clothing/good-american-neon-collection-khloe-kardashian-interview,
Now Is the Time to Buy the Boots You've Been Thinking About for Years,https://www.instyle.com/fashion/shoes/when-to-buy-boots,
Stylists Say These 15 Pieces Are All You Need to Pack For Cute Summer Vacation Outfits,https://www.instyle.com/fashion/clothing/vacation-fashion,
"I'm a Fashion Editor, and These Are My Best Tips For Finding Your Personal Style",https://www.instyle.com/fashion/clothing/how-to-find-your-own-personal-style,
17 Pieces of Music Merch That Are Actually Cute and Wearable,https://www.instyle.com/fashion/clothing/cute-music-merchandise-to-shop,
Printed Jeans Are Back Like It's 2012,https://www.instyle.com/fashion/clothing/printed-jeans,
These 9 'Gen Z' Stores Sell Insanely Cute (and Inexpensive) Clothes,https://www.instyle.com/fashion/clothing/gen-z-clothing-stores,
Everyone Is Dressing Like 2002 Christina Aguilera Now,https://www.instyle.com/fashion/clothing/christina-aguilera-throwback-trends,
"Bring On Butterfly Tails, the Laziest Sexy Trend of the Year",https://www.instyle.com/fashion/clothing/butterfly-tails-corset-trend,
Gossip Girl Costume Designer Eric Daman Definitely Felt Pressure Dressing This New Cast,https://www.instyle.com/fashion/clothing/eric-daman-gossip-girl-costumes-interview,https://imagesvc.meredithcorp.io/v3/mm/image?url=https%3A%2F%2Fimagesvc.meredithcorp.io%2Fv3%2Fmm%2Fimage%3Furl%3Dhttps%253A%252F%252Fstatic.onecms.io%252Fwp-content%252Fuploads%252Fsites%252F14%252F2021%252F07%252F08%252F070821_gossip_girl_lead.jpg&w=426&h=285&q=85&c=tc&rect=0%2C60%2C2000%2C1393
Doja Cat Is a Futuristic Fashion Alien — and That's What Sets Her Apart,https://www.instyle.com/celebrity/doja-cat-futuristic-style,https://imagesvc.meredithcorp.io/v3/mm/image?url=https%3A%2F%2Fimagesvc.meredithcorp.io%2Fv3%2Fmm%2Fimage%3Furl%3Dhttps%253A%252F%252Fstatic.onecms.io%252Fwp-content%252Fuploads%252Fsites%252F14%252F2021%252F07%252F02%252F070221_doja_cat_4.jpg&w=426&h=285&q=85&c=tc&rect=0%2C0%2C1500%2C1000
"Macy's Black Friday in July Sale Has Discounts So Big, We Thought They Were Mistakes",https://www.instyle.com/fashion/macys-black-friday-in-july-sale,
