Blog Title,Blog Link,Thumbnail Link
"Outer Banks' Madison Bailey, a Gen Z-er, Says It's OK to Wear Skinny Jeans",https://www.instyle.com/fashion/clothing/madison-bailey-american-eagle-campaign-fashion-interview,
"So, This Is What It's Like to Be a Runway Model Right Now",https://www.instyle.com/awards-events/fashion-week/alberta-ferretti-fall-2021-model-diary,
23 Up-and-Coming Fashion Brands Celebrity Stylists Are Loving Right Now,https://www.instyle.com/fashion/clothing/best-new-fashion-brands-according-to-celebrity-stylists,
Potato Brown Is the Flattering Color Trend That's Suddenly Everywhere,https://www.instyle.com/fashion/clothing/potato-brown-color-trend,
11 Outfits That Prove Dr. Martens Are Even More Versatile Than Your Go-To Sneakers,https://www.instyle.com/fashion/shoes/dr-martens-outfits,
These 7 Brilliant Tricks Are the Easiest Ways to Clean Suede Shoes,https://www.instyle.com/fashion/shoes/how-to-clean-suede-shoes,
Rory's Outfits On Gilmore Girls Are Bad — And That's Why I Love Them,https://www.instyle.com/fashion/clothing/gilmore-girls-style-rory-sweater-outfit,
11 Birthday Outfit Ideas That Are Guaranteed to Make Your Day Extra Special,https://www.instyle.com/fashion/clothing/birthday-outfit-ideas,
"From Bright Orange to Dusty Pink, These Are the Best Colors to Wear For Spring 2021",https://www.instyle.com/fashion/clothing/spring-2021-color-trends,
The Chunky Neck Is the Fall 2021 Fashion Trend You Can Start Wearing Now,https://www.instyle.com/awards-events/fashion-week/nyfw-trend-chunky-neck-collar-details,
Virtual Fashion Week Didn't Stop These 20 Style Icons From Wearing Their Best Outfits,https://www.instyle.com/awards-events/fashion-week/best-plus-size-street-style-fashion-week-outfits-february-2021,
The 12 Best Places to Buy Swimsuits in 2021,https://www.instyle.com/fashion/clothing/best-places-to-buy-swimsuits-2021,
"Wow, Cult Gaia's Spring 2021 Collection Just Made Us So Excited for Summer",https://www.instyle.com/fashion/clothing/cult-gaia-spring-2021-collection,
Julia Roberts’ ‘Ugly’ Shoes and Skirt Combo From Runaway Bride Still Confuses Me,https://www.instyle.com/celebrity/julia-roberts/julia-roberts-runaway-bride-fashion,
13 Fashion Trends You Definitely Aren't 'Too Old' to Wear,https://www.instyle.com/fashion/clothing/fashion-trends-not-too-old-to-wear,
I’m a Fashion Editor with a Closet Full of Shoes — But These Are My 8 Favorite Pairs,https://www.instyle.com/fashion/shoes/best-shoes-fashion-editors-picks,
It’s Impossible to Look at These Photos and Not Want an Oversized Rainbow Scarf,https://www.instyle.com/fashion/accessories/rainbow-scarf-fashion-trend,
The Pully Top Is the New Strange Fashion Trend Celebrities Can't Stop Wearing,https://www.instyle.com/fashion/pully-top-fashion-trend,
12 Fashion Tricks Emma Watson Has Been Pulling Since Her Harry Potter Days,https://www.instyle.com/celebrity/emma-watson/emma-watson-best-outfits-style-rules,
Celebrities Are Trying to Bring Back This Super Confusing '00s Leggings Trend,https://www.instyle.com/fashion/clothing/colorful-leggings-trend,
I Agree With Gen Z: Skinny Jeans Are Over,https://www.instyle.com/fashion/clothing/skinny-jeans-over-denim-trends,
This Under-$40 Tunic Doubles as a Sweater Dress,https://www.instyle.com/fashion/this-under-40-tunic-doubles-as-a-sweater-dress,https://imagesvc.meredithcorp.io/v3/mm/image?url=https%3A%2F%2Fimagesvc.meredithcorp.io%2Fv3%2Fmm%2Fimage%3Furl%3Dhttps%253A%252F%252Fstatic.onecms.io%252Fwp-content%252Fuploads%252Fsites%252F14%252F2021%252F02%252F05%252F020521_sweater_dress_lead-2000.jpg&w=426&h=285&q=85&c=tc&rect=18%2C0%2C1982%2C1309
"If You're 5'5 Or Under, You'll Want to Remember These 11 Petite Fashion Tips",https://www.instyle.com/fashion/clothing/petite-styling-shopping-fashion-tricks,https://imagesvc.meredithcorp.io/v3/mm/image?url=https%3A%2F%2Fimagesvc.meredithcorp.io%2Fv3%2Fmm%2Fimage%3Furl%3Dhttps%253A%252F%252Fstatic.onecms.io%252Fwp-content%252Fuploads%252Fsites%252F14%252F2021%252F04%252F08%252F040821_petite_lead.jpg&w=426&h=285&q=85&c=tc&rect=3%2C0%2C1797%2C1196
16 TikTok Fashion Influencers to Follow for Helpful Style Tips,https://www.instyle.com/fashion/best-tiktok-fashion-accounts-to-follow,
Zendaya's Cutout Dress in Malcolm & Marie Has a Pretty Complicated Backstory,https://www.instyle.com/reviews-coverage/movies/malcolm-and-marie-costumes-law-roach-fashion-interview,
I Finally Tried Cashmere Joggers and Unfortunately Can Never Wear Regular Sweatpants Again,https://www.instyle.com/fashion/clothing/quince-mongolian-cashmere-sweatpants,
"Oh Great, 'Work Pants' Are Back — But Thankfully, It’s Not What You Think",https://www.instyle.com/fashion/clothing/work-pants-trousers-slacks-fashion-trend,
"Everyone Is Racing to Target to Buy This Super Flattering, Viral TikTok Dress",https://www.instyle.com/fashion/clothing/tik-tok-target-viral-dress-wild-fable,
11 Black-Owned Lingerie Brands to Add to Your Underwear Drawer,https://www.instyle.com/fashion/clothing/black-owned-lingerie-brands,
Tory Burch Just Quietly Dropped a New Collection,https://www.instyle.com/fashion/tory-burch-t-monogram-collection-launch,
"Wait, So This Is How Everyone Is Styling Vests Now?",https://www.instyle.com/fashion/clothing/vests-leather-pants-outfit,
"12 Questionable Trends From 2011 That Are, Unfortunately, Back",https://www.instyle.com/fashion/clothing/questionable-2011-fashion-trends-2021,
Black Designers Are Rarely Featured in Top TV Shows and Movies — But That's About to Change,https://www.instyle.com/fashion/black-designer-database-tv-movie-costumes,
Fashion History Forgot the Black Women Who Invented Streetwear,https://www.instyle.com/fashion/clothing/state-of-the-arts-streetwear-history,
"I'm 5'0, and I Swear These Stores Sell the Best Jeans for Petites",https://www.instyle.com/fashion/clothing/best-petite-jeans-shopping,
Dr. Jill Biden's Inauguration Outfit Almost Looked Completely Different,https://www.instyle.com/fashion/markarian-jill-biden-inauguration-outfit-fashion-interview,
"Sarah Jessica Parker Has a Favorite Outfit, and It's a Very Unusual Combination",https://www.instyle.com/celebrity/sarah-jessica-parker/sarah-jessica-parker-baggy-jeans-boots,
Even Michelle Obama Is a Fan of This Intimidating (Yet Cool) Fashion Trick,https://www.instyle.com/fashion/accessories/how-to-wear-a-belt-style,
10 Sustainable Brands You Should be Shopping in 2021,https://www.instyle.com/fashion/clothing/sustainable-fashion-brands-2021,
Binge-Watching Love Island Convinced Me to Buy Lingerie from This Sexy UK Brand,https://www.instyle.com/fashion/clothing/love-island-lingerie-ann-summers,
We Just Noticed Something Interesting About Rihanna's Outfits,https://www.instyle.com/celebrity/rihanna/rihanna-style-rules,
"From a Secret Stash of Under-$100 Prada to 'Regencycore' Fashion, These Are the Best Things to Buy This Week",https://www.instyle.com/fashion/weekend-shopping-update-2021-01-22,
16 Sweater Outfits from TV and Movie History That Are Still So Freakin' Good,https://www.instyle.com/fashion/clothing/best-sweater-outfits-tv-movies,
Kamala Harris' Great-Nieces Adorably Recreated One of Her Childhood Outfits at the Inauguration,https://www.instyle.com/fashion/clothing/kamala-harris-great-nieces-pay-tribute-to-vice-president-coat,
Inaugural Poet Amanda Gorman Just Saved the Too-Short Life of the Puff Headband,https://www.instyle.com/fashion/accessories/amanda-gorman-inauguration-fashion-padded-headband,
We Can't Let Low-Rise Pants Come Back,https://www.instyle.com/fashion/clothing/low-rise-pants-cant-come-back,
Jodie Turner-Smith Found a Winter Coat That's Both Ridiculously Warm and Cute as Hell,https://www.instyle.com/celebrity/jodie-turner-smith-floral-gucci-coat,https://imagesvc.meredithcorp.io/v3/mm/image?url=https%3A%2F%2Fimagesvc.meredithcorp.io%2Fv3%2Fmm%2Fimage%3Furl%3Dhttps%253A%252F%252Fstatic.onecms.io%252Fwp-content%252Fuploads%252Fsites%252F14%252F2021%252F01%252F19%252F011921-jodie-turner-smith-gucci-northface-lead-2000.jpg&w=426&h=285&c=sc&poi=%5B543%2C440%5D&q=85&rect=106%2C240%2C1031%2C857
The 23 Best Bralettes for Nearly Every Cup Size,https://www.instyle.com/fashion/clothing/best-bralettes-for-every-cup-size,https://imagesvc.meredithcorp.io/v3/mm/image?url=https%3A%2F%2Fimagesvc.meredithcorp.io%2Fv3%2Fmm%2Fimage%3Furl%3Dhttps%253A%252F%252Fstatic.onecms.io%252Fwp-content%252Fuploads%252Fsites%252F14%252F2021%252F01%252F15%252Fbralette1-2000.jpg&w=426&h=285&q=85&c=tc&rect=494%2C166%2C1953%2C1138
11 Big 2021 Fashion Trends That Are Already in Your Closet,https://www.instyle.com/fashion/clothing/best-fashion-trends-2021-in-your-closet,
Naomi Osaka Is the New Global Brand Ambassador for Louis Vuitton,https://www.instyle.com/fashion/naomi-osaka-is-the-new-global-brand-ambassador-for-louis-vuitton,
"I’m On Etsy All the Time, and These Are My 15 Favorite Vintage Shops",https://www.instyle.com/fashion/clothing/fashion-editor-best-vintage-shops-etsy,
"Gigi Hadid's Coat Is Cool, But We're Distracted By Her $400 Legging-Pants",https://www.instyle.com/celebrity/gigi-hadid/gigi-hadid-slit-leggings-pants,
We Have to Ask: What's Going on at Prada and Bottega Veneta in 2021?,https://www.instyle.com/fashion/luxury-brands-social-media-existentialism,
"Puffers Look Really Different Lately, and I Like It",https://www.instyle.com/fashion/clothing/rainbow-color-blocked-puffer-coats,
15 Date Night Outfit Ideas You Can Still Wear at Home,https://www.instyle.com/fashion/clothing/date-night-outfit-ideas-for-any-occasion,
Jennifer Lopez and Kim Namjoon Agree: This '00s Trend Is Back,https://www.instyle.com/celebrity/celebrities-wearing-dior-bucket-hats,
Naomi Campbell and Jennifer Lopez Already Wore 2021's Hottest Bikini Brand,https://www.instyle.com/celebrity/best-celebrity-bikinis-melissa-odabash,
"I'm a Fashion Editor, and I've Been Buying This $13 Sweatshirt in Bulk For Years",https://www.instyle.com/fashion/clothing/best-sweatshirt-gildan,
"20 Non-Boring Denim Jackets For Every Occasion, Style, and Price Point",https://www.instyle.com/fashion/clothing/best-denim-jackets-2021,
This Denim Brand Has So Many Celebs Hooked — and Its End of Season Sale Can't Be Rivaled,https://www.instyle.com/fashion/clothing/mother-denim-end-of-season-sale,
"This Lilly Pulitzer Sale Is So Popular, Shoppers Caused the Site to Crash Last Year — and It's Finally Back",https://www.instyle.com/fashion/lilly-pulitzer-2021-lilly-online-sale,
There's a Reason Everyone Still Loves Dior,https://www.instyle.com/fashion/history-of-dior,
The 30 Best Fashion Moments of 2020,https://www.instyle.com/fashion/best-of-2020-fashion-styles,
"It's Time to Finally Clean Out Your Wardrobe With This Easy, Fail-Proof Method",https://www.instyle.com/fashion/clothing/closet-purge-ways-to-clean-out-your-wardrobe,
"My Hands Are Always Cold, But These 12 Pairs of Gloves and Mittens Are Super Warm",https://www.instyle.com/fashion/accessories/best-winter-gloves-and-mittens,
I Still Think These $50 Sneakers Are Cooler Than Any Expensive Shoe I've Owned,https://www.instyle.com/fashion/shoes/vans-slip-on-sneakers,
12 Faux Fur Coats and Jackets That Will Keep You Warm and On-Trend All Winter Long,https://www.instyle.com/fashion/clothing/best-faux-fur-coats-jackets-women,
11 Style Rules Miley Cyrus Has Been Following For Years,https://www.instyle.com/celebrity/miley-cyrus/miley-cyrus-best-outfits-style-rules,
Anya Taylor Joy Finally Made Her First Expensive Fashion Purchase — and Then Lost It,https://www.instyle.com/fashion/anya-taylor-joy-queens-gambit-fashion,
21 Celebrity Outfits That Perfectly Summed Up 2020,https://www.instyle.com/fashion/clothing/sweatshirts-clothes-that-summed-up-2020,
13 Ideas For How to Color Coordinate Your Closet and Keep Your Clothes Organized,https://www.instyle.com/fashion/color-coordinated-closet-ideas,
"Ok, We Just Realized Zoë Kravitz's Best Outfits Include the Same Subtle Detail",https://www.instyle.com/celebrity/zoe-kravitz/zoe-kravitz-green-outfit-details,https://imagesvc.meredithcorp.io/v3/mm/gif?url=https%3A%2F%2Fimagesvc.meredithcorp.io%2Fv3%2Fmm%2Fgif%3Furl%3Dhttps%253A%252F%252Fstatic.onecms.io%252Fwp-content%252Fuploads%252Fsites%252F14%252F2020%252F12%252F16%252F121620-zoe-kravitz-style-lead.gif&w=426&h=285&c=sc&poi=%5B960%2C533%5D&q=85&rect=0%2C0%2C1995%2C1330
8 Cashmere Sweaters You Won't Want to Take Off This Winter,https://www.instyle.com/fashion/best-cashmere-sweaters,https://imagesvc.meredithcorp.io/v3/mm/image?url=https%3A%2F%2Fimagesvc.meredithcorp.io%2Fv3%2Fmm%2Fimage%3Furl%3Dhttps%253A%252F%252Fstatic.onecms.io%252Fwp-content%252Fuploads%252Fsites%252F14%252F2020%252F12%252F08%252F120820-cashmere-sweaters-lead-2000.jpg&w=426&h=285&c=sc&poi=%5B980%2C639%5D&q=85&rect=252%2C0%2C1852%2C1066
This Sneaky Shirt Layering Trick Is Responsible For My Best Winter Outfits,https://www.instyle.com/fashion/clothing/winter-layering-sleeveless-turtleneck,
This Truly Questionable Early '00s Trend Is Back and Here to Stay,https://www.instyle.com/fashion/accessories/newsboy-caps-fashion-trend,
8 Winter Fashion Tips You'll Actually Want to Try in 2021,https://www.instyle.com/fashion/winter-fashion-tips-2021,
"Jennifer Garner Says This Denim Brand Is Her Favorite, and It’s on Sale at Nordstrom for $57",https://www.instyle.com/fashion/jennifer-garner-paige-denim-sale-nordstrom,
Katherine Heigl Wore the Cutest Outfits in This Disney Channel Original Movie,https://www.instyle.com/fashion/katherine-heigl-outfits-disney-channel-original-movie,
The Sweater Your Crush Wore in Middle School Is Cool Again,https://www.instyle.com/fashion/clothing/half-zip-sweater,
"I’m a Fashion Editor, and These Are the Under-$50 Finds I’m Gifting This Year",https://www.instyle.com/holidays-occasions/gift-guides/fashion-under-50-gift-ideas,
"I Swear These Super-Stretchy, $118 Jeans Gave Me the Butt of My Dreams",https://www.instyle.com/fashion/clothing/best-jeans-for-butt-mavi,
There's a Superstition About the Underwear You Wear On New Year's Eve,https://www.instyle.com/holidays-occasions/new-years-eve/new-years-eve-underwear-color-meaning,
There's a Superstition About the Underwear You Wear On New Year's Eve,https://www.instyle.com/holidays-occasions/new-years-eve/new-years-eve-underwear-color-meaning,
"The Top 4 Fashion Trends Worth Following in 2021, According to Celebrity Stylists",https://www.instyle.com/fashion/2021-best-fashion-trends-celebrity-stylists,
"We’ve Fallen in Love With ‘Grandma Coats,’ Winter's Viral Fashion Trend",https://www.instyle.com/fashion/clothing/quilted-coats,
Emily Ratajkowski Is Really Loving Her Pregnancy Crop Tops,https://www.instyle.com/fashion/clothing/emily-ratajkowski-pregnancy-crop-tops,
Taylor Swift's $30 Tights Reminded Me of Winter's Most Brilliant Fashion Trick,https://www.instyle.com/celebrity/taylor-swift/taylor-swift-plaid-tights,
14 Sweater Dress Outfits That Aren't as Basic as They Sound,https://www.instyle.com/fashion/clothing/sweater-dress-outfits,
This Phillip Lim Sequin Dress Is Made Out of Seaweed,https://www.instyle.com/fashion/phillip-lim-seaweed-sequin-dress,
Selena Gomez Matched Her Blanket to Her Loungewear Like a 2020 Fashion Queen,https://www.instyle.com/celebrity/selena-gomez/selena-gomez-outfits-only-murders-in-the-building,
I Live in New York and My Warmest Winter Sweaters Are from This Inexpensive Store,https://www.instyle.com/fashion/clothing/best-winter-sweaters-other-stories,
13 New Year's Eve Outfit Ideas to Help You Celebrate the Start of 2021,https://www.instyle.com/fashion/clothing/new-years-outfit-ideas,
"Kendall Jenner Apparently Loves This 'Grandpa' Outfit So Much, She Wore It Twice",https://www.instyle.com/celebrity/kendall-jenner/kendall-jenner-grandpa-outfit-repeat,
"Jennifer Lopez Might Be Sending Us a Message Through Her Favorite, Fun Accessory",https://www.instyle.com/look-of-the-day/2020-12-04,
Bella Hadid's Go-To Party Dress Isn't What You'd Expect,https://www.instyle.com/celebrity/bella-hadid/bella-hadid-michael-kors-holiday,
Victoria Beckham Designed a Fancy Pair of Leggings That Can Actually Pass as Pants,https://www.instyle.com/fashion/clothing/victoria-beckham-reebok-knit-leggings,
Chanel Wants You to Wear Footless Tights Under Your Skirt Like It's 2006,https://www.instyle.com/fashion/runway/chanel-leggings-footless-tights-le-chateau-des-sames-2021,https://imagesvc.meredithcorp.io/v3/mm/image?url=https%3A%2F%2Fimagesvc.meredithcorp.io%2Fv3%2Fmm%2Fimage%3Furl%3Dhttps%253A%252F%252Fstatic.onecms.io%252Fwp-content%252Fuploads%252Fsites%252F14%252F2020%252F12%252F03%252FFootless-Tights-lead-2000.jpg&w=426&h=285&q=85&c=tc
Irina Shayk's Bag Looks Like It's Slowly Morphing Into a Sneaker,https://www.instyle.com/fashion/accessories/irina-shayk-sneaker-bag,https://imagesvc.meredithcorp.io/v3/mm/image?url=https%3A%2F%2Fimagesvc.meredithcorp.io%2Fv3%2Fmm%2Fimage%3Furl%3Dhttps%253A%252F%252Fstatic.onecms.io%252Fwp-content%252Fuploads%252Fsites%252F14%252F2020%252F12%252F03%252Firina-shayk-1-2000.jpg&w=426&h=285&q=85&c=tc&rect=169%2C314%2C1235%2C1025
5 Timeless Fashion Lessons We Learned from Selena,https://www.instyle.com/fashion/clothing/selena-quintanilla-fashion-style-lessons,
12 Dog Sweaters That Have Human Counterparts So You Can Match Your Pet,https://www.instyle.com/fashion/clothing/matching-dog-human-sweaters,
My Hunt for the Perfect Black Turtleneck Ended When I Discovered This Bodysuit,https://www.instyle.com/fashion/clothing/spanx-black-friday-cyber-monday-sale-turtleneck-bodysuit,
Everything You've Ever Wanted to Know About Fendi's Fascinating History,https://www.instyle.com/fashion/history-of-fendi,
I’m 5’0 and I Swear These Three Simple Shoe Tricks Make Me Look Taller,https://www.instyle.com/fashion/clothing/petite-styling-tricks-shoes,
The Best Coats From The Undoing Fortunately Have Affordable Alternatives,https://www.instyle.com/fashion/clothing/the-undoing-coats-where-to-shop,
4 Outfits From Holiday Movies That Are Totally Worth Copying This Year,https://www.instyle.com/fashion/clothing/holiday-movies-outfits,
The World Finally Discovered Victoria Beckham's Fancy Leggings Trick,https://www.instyle.com/fashion/clothing/victoria-beckham-fancy-leggings-trick,
"I Promise You, Ugg Boots Actually Look Cute as Hell with Skirts and Dresses",https://www.instyle.com/fashion/shoes/how-to-style-uggs-skirt-dresses,
Hailey Bieber Sneakily Recreated Her Iconic Halloween Costume For Her Birthday,https://www.instyle.com/celebrity/hailey-baldwin/hailey-bieber-sandy-grease-latex-leggings,
Megan Thee Stallion's Dominatrix Bodystocking Is an Unexpected Wardrobe Staple,https://www.instyle.com/fashion/clothing/megan-thee-stallion-bodystocking,
I'm Still Going to Wear These 4 Kinda-Outrageous Holiday Party Outfits at Home,https://www.instyle.com/fashion/clothing/holiday-party-outfits,
22 Pairs of Holiday Pajamas That You Won't Feel Weird Wearing All Winter Long,https://www.instyle.com/fashion/clothing/holiday-pajamas,
7 Holiday Accessories You Can Officially Start Wearing Today,https://www.instyle.com/fashion/accessories/holiday-accessories-earrings-socks,
Kylie Jenner and Hailey Bieber Aren't Giving Up On This Super Sexy '00s Trend,https://www.instyle.com/fashion/clothing/pvc-latex-pants-trend,
'GucciFest' Is Here — and We've Got Your Ultimate Viewing Guide,https://www.instyle.com/fashion/what-is-guccifest-how-to-watch,
Emma Roberts Has Been Wearing the Same Coat Since 2012 — and It Even Pops Up in Holidate,https://www.instyle.com/celebrity/emma-roberts/emma-roberts-leopard-coat-outfits,
Sandra Bullock's Gray Sweater From While You Were Sleeping Is the Best Part of That Movie,https://www.instyle.com/fashion/clothing/sandra-bullock-while-you-were-sleeping-sweaters,
Don't Be Surprised When Celebrities Start Wearing These 'Chaotic' '80s-Inspired Coats,https://www.instyle.com/fashion/clothing/karla-welch-eddie-bauer-outerwear-collaboration,
"I Bought Instagram’s Viral White Boots, and Now I Wear Them With Everything",https://www.instyle.com/fashion/shoes/dr-martens-2976-platform-chelsea-boot-white,
The Outfits On the New Gossip Girl Look So Familiar — Because Jenny Already Wore Them,https://www.instyle.com/reviews-coverage/tv-shows/gossip-girl-spin-off-outfits-jenny-humphrey,
Freaky's Kathryn Newton Accidentally Cut Up a Museum-Worthy Chanel Suit,https://www.instyle.com/celebrity/kathryn-newton-freaky-movie-fashion-interview,
"My Legs Hate Jeans, But This Cool Leopard Pair Is Weirdly Comfy",https://www.instyle.com/fashion/clothing/paige-leopard-jeans-outfits,
Sarah Jessica Parker Wore the Denim Brand That’s About to Blow Up,https://www.instyle.com/fashion/sarah-jessica-parker-etica-denim-nordstrom,https://imagesvc.meredithcorp.io/v3/mm/image?url=https%3A%2F%2Fimagesvc.meredithcorp.io%2Fv3%2Fmm%2Fimage%3Furl%3Dhttps%253A%252F%252Fstatic.onecms.io%252Fwp-content%252Fuploads%252Fsites%252F14%252F2020%252F11%252F10%252F111020_sjp_lead-2000.jpg&w=426&h=285&q=85&c=tc&rect=64%2C78%2C1522%2C1049
"Brace Yourself, Because Butt Fashion Is Back",https://www.instyle.com/fashion/clothing/butt-fashion-trend-g-string-graphic-printed-pants,https://imagesvc.meredithcorp.io/v3/mm/image?url=https%3A%2F%2Fimagesvc.meredithcorp.io%2Fv3%2Fmm%2Fimage%3Furl%3Dhttps%253A%252F%252Fstatic.onecms.io%252Fwp-content%252Fuploads%252Fsites%252F14%252F2021%252F07%252F02%252F070221_butt_fashion_lead.jpg&w=426&h=285&q=85&c=tc&rect=0%2C162%2C1342%2C1056
6 Quick Gift Ideas for the Badass Who Has Everything,https://www.instyle.com/holidays-occasions/gift-guides/instyle-badass-collaborations-gift-guide,
Every Major Celebrity Is Weirdly Wearing the Same Outfit Right Now,https://www.instyle.com/fashion/clothing/celerity-sweatsuits-matching-outfits,
"All the Vests On Sister, Sister Were Outrageously Good",https://www.instyle.com/reviews-coverage/tv-shows/sister-sister-tv-show-fashion-vests,
"Halloween Is Over, But Spain's Queen Letizia Is Still Wearing Witch Boots",https://www.instyle.com/celebrity/queen-letizia/queen-letizia-pointy-black-boots-plaid-pants,
Sarah Jessica Parker Has Been Pulling This Brilliant Jeans Trick Since the '80s,https://www.instyle.com/fashion/clothing/sarah-jessica-parker-jeans,
Gabrielle Union Is the Latest Celebrity to Revive This Y2K Shoe Trend,https://www.instyle.com/celebrity/gabrielle-union-ugg-disco-slide-slippers,
Everyone Is Breaking the Rules and Still Wearing This Summer Color,https://www.instyle.com/fashion/clothing/hot-pink-outfits,
9 Staycation Outfit Ideas That Will Make You Feel Like You're Actually On Vacation,https://www.instyle.com/fashion/clothing/staycation-outfit-ideas,
We Just Realized Something About Jennifer Lopez's Quarantine Outfits,https://www.instyle.com/celebrity/jennifer-lopez/jennifer-lopez-quarantine-outfits,
8 Creative Layering Techniques That Will Make Your Winter Outfits Cute as Hell,https://www.instyle.com/how-tos/how-to-layer-clothes,
"Lorde Just Made Her First Public Appearance in 18 Months, and We Found the Exact Dress She Wore",https://www.instyle.com/celebrity/lorde-realisation-par-the-alba-rosalita-dress,
8 Types of Jackets and Coats That Will Make Your Life So Much Easier,https://www.instyle.com/fashion/clothing/best-types-of-jackets-coats-for-women,
Fleece-Lined Pants Are the Only Pants Worth Wearing This Winter,https://www.instyle.com/fashion/clothing/best-fleece-lined-pants,
"11 Stretchy, Comfy, and Cute Thanksgiving Outfits to Wear This Year",https://www.instyle.com/holidays-occasions/thanksgiving/cute-thanksgiving-outfits,
"Yes, It's Possible For Raincoats to Be Both Practical and Cute",https://www.instyle.com/fashion/clothing/best-raincoats-for-women,
"Somehow, the Insanely Sexy Celebrity Bracket Trend Is Still Alive and Thriving",https://www.instyle.com/fashion/clothing/bra-jacket-cardigan-fashion-trend,
16 Celebrity-Approved Tricks For Looking Cute In Impossibly Cold Weather,https://www.instyle.com/fashion/street-style/winter-street-style,
I’ve Lived in New York My Whole Life and These Are the Only Coats That Keep Me Warm,https://www.instyle.com/fashion/clothing/warmest-winter-coats-for-women,
Princess Diana’s Most Iconic Outfits All Included the Color Red,https://www.instyle.com/celebrity/princess-diana/princess-diana-best-red-outfits,
This Random Schoolcore Trend Has Produced Instagram’s Most Popular Outfit,https://www.instyle.com/fashion/clothing/pleated-skirt-sweatshirt-schoolcore-soft-girl-fashion-trend,
7 Hat Trends Worth Investing In This Fall and Winter,https://www.instyle.com/fashion/accessories/best-fall-winter-hats,
"So, There's Actually a Reason Why Witches Wear Pointed Hats and Fly On Brooms",https://www.instyle.com/fashion/clothing/witch-outfit-history-theories,
Harry Styles Randomly Wore the Same T-Shirt as Rachel Green From Friends,https://www.instyle.com/celebrity/harry-styles/harry-styles-rachel-green-friends-shirt,
"Apologies in Advance, But Holes Are the New Polka-Dots",https://www.instyle.com/fashion/clothing/holes-cutout-clothing-fashion-trend,https://imagesvc.meredithcorp.io/v3/mm/image?url=https%3A%2F%2Fimagesvc.meredithcorp.io%2Fv3%2Fmm%2Fimage%3Furl%3Dhttps%253A%252F%252Fstatic.onecms.io%252Fwp-content%252Fuploads%252Fsites%252F14%252F2020%252F10%252F19%252F101920_future_of_fashion_holes_lead1-2000.jpg&w=426&h=285&q=85&c=tc&rect=0%2C0%2C2000%2C1333
Of Course Sarah Jessica Parker Paired a Purple Blanket Dress With Bright Pink Heels,https://www.instyle.com/look-of-the-day/2020-10-16,https://imagesvc.meredithcorp.io/v3/mm/image?url=https%3A%2F%2Fimagesvc.meredithcorp.io%2Fv3%2Fmm%2Fimage%3Furl%3Dhttps%253A%252F%252Fstatic.onecms.io%252Fwp-content%252Fuploads%252Fsites%252F14%252F2020%252F10%252F16%252F101620-lotd-sarah-jessica-parker-lead-2000.jpg&w=426&h=285&c=sc&poi=%5B639%2C360%5D&q=85&rect=248%2C218%2C959%2C692
"Kelly Rowland Says She Wants to Dress ""Sexier"" During Her Second Pregnancy",https://www.instyle.com/celebrity/kelly-rowland/kelly-rowland-justfab,
