Blog Title,Blog Link,Thumbnail Link
"Statement Tees Are Trending Again, So We Made You One",https://www.instyle.com/reviews-coverage/ladies-first-podcast-laura-brown/ladies-first-merch-collection,
Demi Moore and Her Daughters Wear Matching Swimsuits in Andie's Latest Campaign,https://www.instyle.com/fashion/clothing/demi-moore-daughters-andie-swim,
The Summer-3 Fashion Rule Is the Easy Yet Smart Outfit Trick You Have to Try,https://www.instyle.com/fashion/clothing/the-summer-3-fashion-rule-is-the-seasons-best-outfit-idea,
The Brami Is the Sleek Adult Update to the Cami You Wore in Middle School,https://www.instyle.com/fashion/clothing/brami-bra-cami,
"Gothcore Is Fashion's Sexy, Spooky Response to Dressing Like a Prairie Girl",https://www.instyle.com/fashion/clothing/gothcore-fashion-trend,
The $118 Butt-Lifting Leggings Celebs Love Are Just $29 Right Now,https://www.instyle.com/fashion/noli-yoga-fourth-of-july-sale-2021,
"Celebrity Stylist Maeve Reilly Weighs in On 'Ugly' Fashion, Affordable Sneakers, and Coordinating Couples",https://www.instyle.com/fashion/clothing/celebrity-stylist-maeve-reilly-fashion-tips-interview,
"The Controversial Graphic Tee Trend Is Back, and It Feels Like It's 2002",https://www.instyle.com/fashion/clothing/graphic-t-shirt-trend,
This Is Marc Jacobs' Moment and He Knows It,https://www.instyle.com/fashion/runway/marc-jacobs-fall-2021-review,
"Models Are Already Wearing Fall Outfits, Just, FYI",https://www.instyle.com/fashion/clothing/celebrity-fall-outfits,
"So, Kim Kardashian Is Designing the Official Team USA Undergarments at the Olympics",https://www.instyle.com/fashion/clothing/skims-olympics-undergarments,
10 Braless (Yet Supportive) Outfit Ideas to Try This Summer,https://www.instyle.com/fashion/clothing/braless-outfit-ideas,
Kendall Jenner Added a Twist to the Supermodel-Approved Paperclip Top,https://www.instyle.com/celebrity/kendall-jenner/kendall-jenner-vest,
"Finally, a Pair of Shorts That Can Do It All — Spanx's Water-Resistant Shorts Just Restocked",https://www.instyle.com/fashion/clothing/spanx-sunshine-shorts-collection-restock,
10 Times Kourtney Kardashian and Travis Barker Coordinated Their Outfits,https://www.instyle.com/celebrity/kourtney-kardashian/kourtney-kardashian-travis-barker-coordinated-outfits,
"Brock Collection x H&M Is Here, and According to the Designers, These 4 Pieces Are Must-Haves",https://www.instyle.com/fashion/clothing/brock-collection-hm-collaboration,
It's Not Your Imagination - Extreme Mamma Mia Bell Bottoms Are Trending,https://www.instyle.com/fashion/clothing/bell-bottoms-flare-pants-trend,
"13 Fall Dress Trends That Actually Work For Summer, Too",https://www.instyle.com/fashion/clothing/fall-dresses-2021,
These 11 Fashion Trends Are Going Viral This Summer - But They're Actually From the '70s,https://www.instyle.com/fashion/clothing/70s-summer-fashion-trends,
The Most Hated Jeans on the Internet Are Now Just $33 for Prime Day — and They're Selling Fast,https://www.instyle.com/fashion/levis-denim-deals-skinny-jeans-amazon-prime-day-2021,
Paper Clip Tops Are the Latest Strange But Super Sexy Trend Models Are Loving ,https://www.instyle.com/fashion/clothing/paper-clip-crop-top-trend,
Millennial Mom Jeans Are Taking Over As the Next Big Denim Craze,https://www.instyle.com/fashion/clothing/millennial-mom-jeans,
"How to Wear Cottagecore In 2021, Because the Whimsical Aesthetic Isn't Going Anywhere",https://www.instyle.com/fashion/clothing/how-to-wear-cottagecore-trend,https://imagesvc.meredithcorp.io/v3/mm/image?url=https%3A%2F%2Fimagesvc.meredithcorp.io%2Fv3%2Fmm%2Fimage%3Furl%3Dhttps%253A%252F%252Fstatic.onecms.io%252Fwp-content%252Fuploads%252Fsites%252F14%252F2021%252F06%252F17%252F061721-cottagecore-lead-2000.jpg&w=426&h=285&c=sc&poi=%5B634%2C420%5D&q=85&rect=19%2C208%2C1405%2C1131
Michael Strahan Has Some Great Last-Minute Father's Day Gift Ideas,https://www.instyle.com/fashion/clothing/michael-strahan-fashion-fathers-day-juneteenth-interview,https://imagesvc.meredithcorp.io/v3/mm/image?url=https%3A%2F%2Fimagesvc.meredithcorp.io%2Fv3%2Fmm%2Fimage%3Furl%3Dhttps%253A%252F%252Fstatic.onecms.io%252Fwp-content%252Fuploads%252Fsites%252F14%252F2021%252F06%252F18%252FMichael-Strahan-lead-2000.jpg&w=426&h=285&q=85&c=tc&rect=200%2C180%2C1800%2C1247
Katie Holmes Wore the Best Pair of Jeans - As Joey Potter On Dawson's Creek,https://www.instyle.com/celebrity/katie-holmes/katie-holmes-joey-potter-jeans,
The Most Divisive Trend of the Summer Is This Tarzan-Like String Bikini Bottom,https://www.instyle.com/fashion/clothing/side-tie-string-bikini-bottom-trend,
Every Celebrity Is Dressing Like '90s Cindy Crawford Right Now,https://www.instyle.com/fashion/clothing/celebrities-wearing-white-shirts-and-jeans,
"TikTok Discovered That Target Has the Best Summer Dresses, and We Can't Disagree",https://www.instyle.com/fashion/target-summer-dresses-tiktok,
Jennifer Lopez and Ben Affleck's '00s Couple Outfits Are Surprisingly On-Trend For 2021,https://www.instyle.com/celebrity/jennifer-lopez/jennifer-lopez-ben-afflecks-00s-couple-outfits,
Are You Ready For Butt Ruffle Bathing Suits?,https://www.instyle.com/fashion/clothing/butt-ruffle-bathing-suit-trend,
8 Major Summer Fashion Trends That Are Already in Your Closet,https://www.instyle.com/fashion/clothing/best-summer-2021-fashion-trends-in-your-closet,
Irina Shayk Is Making a Strong Case For Wearing Boots in the Summer,https://www.instyle.com/fashion/shoes/irina-shayk-tamara-mellon-shoe-collaboration,
How to Fray Jeans at Home in 4 Easy Steps,https://www.instyle.com/fashion/clothing/how-to-fray-jeans,
Your Favorite Sunglasses Brand Just Released the Cutest Sustainable Collection,https://www.instyle.com/fashion/garrett-leight-parks-project-capsule-collection,
Looking Back at the Fashion From Younger,https://www.instyle.com/fashion/clothing/younger-tv-show-costumes-final-season,
Khloé Kardashian Posed Topless For Good American's New Campaign,https://www.instyle.com/celebrity/khloe-kardashian/khloe-kardashian-topless-for-good-americans-new-campaign,
How to Style a Corset Without Looking Like You're Attempting Victorian Cosplay,https://www.instyle.com/fashion/clothing/corset-outfits,
"Ferris Bueller's Day Off Turns 35 This Month, and I Still Want to Dress Like His Girlfriend, Sloane Peterson",https://www.instyle.com/fashion/clothing/ferris-buellers-day-off-sloane-peterson-fashion,
When Do Fat People Get Gender-Neutral Fashion?,https://www.instyle.com/fashion/clothing/plus-size-gender-neutral-style,
"Of All the Ways Clothing Is Gendered, Pockets Are the Most Ridiculous",https://www.instyle.com/fashion/clothing/womens-clothing-with-pockets,
The New Capsule Wardrobe Is Genderless,https://www.instyle.com/fashion/clothing/unisex-capsule-wardrobe,
We Need to Be Paying Attention to South Asian Fashion,https://www.instyle.com/fashion/clothing/south-asian-designers,
Gender-Free Fashion Needs to Start in the Kids' Department,https://www.instyle.com/fashion/clothing/gender-neutral-kids-styles,
The 11 Best Genderless Fashion Lines to Shop Right Now,https://www.instyle.com/fashion/clothing/gender-neutral-brands,
The Life-Changing Power of the Right Kind of Underwear,https://www.instyle.com/fashion/clothing/gender-affirming-underwear,
"On TikTok, Fashion Is Already Post-Gender",https://www.instyle.com/fashion/clothing/tiktok-gender-free-fashion,
Gigi Hadid's Sweater Looks Like It Was Made By Your Grandma,https://www.instyle.com/celebrity/gigi-hadid/gigi-hadid-grandma-sweater,
11 Brands that Support the LGBTQ+ Community All Year Round,https://www.instyle.com/fashion/clothing/brands-supporting-lgbtq,https://imagesvc.meredithcorp.io/v3/mm/image?url=https%3A%2F%2Fimagesvc.meredithcorp.io%2Fv3%2Fmm%2Fimage%3Furl%3Dhttps%253A%252F%252Fstatic.onecms.io%252Fwp-content%252Fuploads%252Fsites%252F14%252F2021%252F06%252F03%252F060321_pride_where_to_shop_lead.jpg&w=426&h=285&q=85&c=tc&rect=0%2C0%2C1800%2C1200
"So Many Styles of This Ugly ""It Shoe"" Are Marked Down at Nordstrom — and Prices Start at $12",https://www.instyle.com/fashion/shoes/nordstrom-half-yearly-sale-slide-sandals-2021,https://imagesvc.meredithcorp.io/v3/mm/image?url=https%3A%2F%2Fimagesvc.meredithcorp.io%2Fv3%2Fmm%2Fimage%3Furl%3Dhttps%253A%252F%252Fstatic.onecms.io%252Fwp-content%252Fuploads%252Fsites%252F14%252F2021%252F06%252F02%252F060221_shower_slides_lead.jpg&w=426&h=285&q=85&c=tc&rect=0%2C0%2C2000%2C1333
Grab Your Wallet: Rixo Just Launched the Cutest Sustainable Swim Line That Starts at $73,https://www.instyle.com/fashion/clothing/rixo-sustainable-swimsuits,
The Investment Pieces Busy Philipps Will Never Stop Re-Wearing,https://www.instyle.com/celebrity/busy-philipps/busy-philipps-fashion-interview-credit-karma,
Light Academia Is the Rising Trend Threatening to Replace Cottagecore,https://www.instyle.com/fashion/clothing/light-academia-fashion-trend,
These 10 Plus-Size Summer Outfit Ideas Are So Cute We Could Scream,https://www.instyle.com/fashion/clothing/plus-size-summer-outfits,
Target Already Discounted Thousands of Items for Memorial Day Weekend,https://www.instyle.com/fashion/target-memorial-day-weekend-deals-2021,
Anne Hathaway's Layered Outfit Just Transported Me Back to 2012,https://www.instyle.com/fashion/clothing/anne-hathaway-wecrashed-layered-outfit,
This AAPI-Owned Brand Makes Bras That Finally Fit Small Boobs,https://www.instyle.com/fashion/clothing/pepper-bras-interview,
PSA: This Sustainable Denim Brand Is Offering Deals as Low as $32,https://www.instyle.com/fashion/clothing/g-star-raw-memorial-day-sale-2021,
"Someone Alert Christina Aguilera, Because Twisted Halter-Neck Tops Are Trending",https://www.instyle.com/fashion/clothing/twisted-halter-neck-tops-and-dresses,
These $14 Slides Will Be the Next Ugly Sandals to Earn a Place in Your Heart and Gym Bag,https://www.instyle.com/fashion/shoes/funkymonkey-non-slip-slide-sandal-amazon,
The 7 Best Bathing Suits For Long Torsos,https://www.instyle.com/fashion/clothing/best-long-torso-swimsuits,
12 Memorial Day Outfit Ideas to Wear All Weekend (and Summer) Long,https://www.instyle.com/fashion/clothing/memorial-day-outfit-ideas,
16 Summer Dresses That You Can Actually Wear With a Bra,https://www.instyle.com/fashion/clothing/summer-dresses-for-big-busts-wear-with-bra,
Fashion Experts Reveal What to Wear to a Beach Wedding — and What to Avoid,https://www.instyle.com/fashion/clothing/beach-wedding-guest-outfit-ideas,
Cynthia Erivo's Billboard Music Awards Jewelry Contained a Hidden Jewel No One Could See,https://www.instyle.com/awards-events/red-carpet/jason-bolden-cynthia-erivo-billboard-awards,
"Fairycore Fashion is the Dreamy, Ethereal Trend You Have to Try",https://www.instyle.com/fashion/clothing/fairycore-fashion-trend,
Halle Berry Designed the Sexiest Black Dress — and It's Actually Workout Clothes,https://www.instyle.com/fashion/clothing/halle-berry-lindsay-flores-sweaty-betty-collaboration,
"What to Wear for a Summer Job Interview, According to 11 Different Professionals",https://www.instyle.com/fashion/clothing/summer-interview-outfits,
"I’m a Fashion Editor, and These 6 Fashion Tricks Make My Outfits Look More Expensive",https://www.instyle.com/fashion/clothing/fashion-tricks-to-make-outfits-look-more-expensive,
We're Finally Giving Into the Cute But Confusing Summer Knits Trend,https://www.instyle.com/fashion/clothing/summer-knitwear-trend,
The Ultimate Must-See Moment From MTV's TV & Movie Awards? Bling Empire's Christine Chiu's Dress,https://www.instyle.com/fashion/christine-chiu-mtv-tv-movie-awards-2021,
Everything to Buy From Target's Designer Dress Collection Before It Sells Out,https://www.instyle.com/fashion/clothing/target-designer-dress-collection-shop,
How Mo Became the Best Dressed Character on Zoey's Extraordinary Playlist,https://www.instyle.com/fashion/clothing/zoeys-extraordinary-playlist-mo-costumes,
So Many Top Models Are Dressing Like Ice Cream Cones Right Now,https://www.instyle.com/fashion/clothing/ice-cream-cone-fashion-trend,https://imagesvc.meredithcorp.io/v3/mm/image?url=https%3A%2F%2Fimagesvc.meredithcorp.io%2Fv3%2Fmm%2Fimage%3Furl%3Dhttps%253A%252F%252Fstatic.onecms.io%252Fwp-content%252Fuploads%252Fsites%252F14%252F2021%252F05%252F13%252F051321-ice-cream-dressing-khaki-pants-white-top-lead-2000.jpg&w=426&h=285&c=sc&poi=%5B980%2C546%5D&q=85&rect=0%2C0%2C2000%2C1333
All the Cool Pants Have Ankle Straps (aka Leg Belts) Now,https://www.instyle.com/fashion/clothing/ankle-strap-pants,https://imagesvc.meredithcorp.io/v3/mm/image?url=https%3A%2F%2Fimagesvc.meredithcorp.io%2Fv3%2Fmm%2Fimage%3Furl%3Dhttps%253A%252F%252Fstatic.onecms.io%252Fwp-content%252Fuploads%252Fsites%252F14%252F2021%252F05%252F11%252F051121_fof_pants_lead.jpg&w=426&h=285&q=85&c=tc&rect=0%2C0%2C2000%2C1333
"Gen Z Just Turned This Confusing, Ugly '90s Trend Into Summer's Hottest Item",https://www.instyle.com/fashion/clothing/skort-fashion-trend-outfit-ideas,
9 Sexy Swimsuit Style Lessons We've Learned From Jennifer Lopez,https://www.instyle.com/celebrity/jennifer-lopez/jennifer-lopez-bathing-suit-style,
H&M's Lemlem Collaboration Delivers a Supermodel Styling Trick Using Recycled Plastic,https://www.instyle.com/fashion/lemlem-x-hm-liya-kebede-interview,
How to Align Your Wardrobe With Your Aura to Radiate Good Vibes 24/7,https://www.instyle.com/fashion/clothing/how-to-align-your-wardrobe-with-your-aura,
The Coolest (and Surprisingly Easy) Tank Top Hacks We Learned From TikTok,https://www.instyle.com/fashion/clothing/tiktok-tank-top-tricks,
6 Times BTS Wore Louis Vuitton (and We Swooned),https://www.instyle.com/fashion/clothing/bts-louis-vuitton-style,
This Audrey Hepburn Dress Is Way Better Than Anything She Wore in Breakfast at Tiffany's,https://www.instyle.com/celebrity/audrey-hepburn/audrey-hepburn-sabrina-dress,
"I'm Over 30, But I'm Regressing Back to My Sexy, Early-20s Style For #ShotGirlSummer",https://www.instyle.com/fashion/clothing/sexy-shot-girl-summer-style,
This Emotional Fashion Trend Is a Great Way to Silently Express Your Mood,https://www.instyle.com/fashion/clothing/emotional-happy-sad-emoji-clothing-trend,
"The Days of Chaotic, Below-the-Waist Fashion Are Finally Here",https://www.instyle.com/fashion/clothing/below-the-waist-fashion-trends,
Midriffs Were Definitely the Winning Trend at the 2021 Oscars,https://www.instyle.com/awards-events/red-carpet/oscars/midriffs-trend-oscars-2021,
5 Easy Spring Trends That Are Already in Your Closet,https://www.instyle.com/fashion/clothing/easy-spring-trends-you-already-own,
"These Brands Donate to Environmental Causes, Even When It’s Not Earth Day",https://www.instyle.com/fashion/clothing/brands-that-donate-to-environmental-causes,
"10 Fashion Trends You Loved as a Kid, and the Adult Counterpart to Wear Today",https://www.instyle.com/fashion/clothing/kid-fashion-trends-for-adults,
"If Your Sustainable Fashion Doesn't Announce Itself, Does it Count?",https://www.instyle.com/fashion/eco-friendly-clothing-labels,
"Meredith Koop on Styling Michelle Obama, the Drama of Re-Wears, and What Comes Next",https://www.instyle.com/celebrity/meredith-koop-michelle-obama-stylist,
Fashion's Biggest Spring Trend Is Also Its Most Literal,https://www.instyle.com/fashion/clothing/egg-fashion-trend,
It's Not Your Imagination — These 5 Prints Are Everywhere This Spring,https://www.instyle.com/fashion/clothing/spring-prints-trends,
There's Never Been a Better Time to Learn to Knit,https://www.instyle.com/fashion/knitting-crochet-trend-summer-2021,
3 Celebrity-Loved Designers Are Partnering With Target On 70 Dresses — For Under $60,https://www.instyle.com/fashion/clothing/target-designer-dress-collection-christopher-john-rogers-alexis-rixo,
Leave it to TikTok to Find a $20 Dupe of Lululemon's Biker Shorts,https://www.instyle.com/fashion/heathyoga-amazon-biker-shorts-lululemon-dupe,
Beyoncé Wore a Blinged-Out Blazer and No Bra,https://www.instyle.com/celebrity/beyonce-knowles/beyonce-instagram-white-blazer-nameplate-chains,
14 Cute Summer Shoes That Shockingly Aren't Slippers,https://www.instyle.com/fashion/clothing/summer-shoes-for-women,
"This Is The Easiest Way To Make Your Outfit Look Better, According to Stylists",https://www.instyle.com/fashion/clothing/make-clothes-fit-better-tips,https://imagesvc.meredithcorp.io/v3/mm/image?url=https%3A%2F%2Fimagesvc.meredithcorp.io%2Fv3%2Fmm%2Fimage%3Furl%3Dhttps%253A%252F%252Fstatic.onecms.io%252Fwp-content%252Fuploads%252Fsites%252F14%252F2021%252F04%252F08%252F040821_www_clothes_fit_better_lead.jpg&w=426&h=285&q=85&c=tc&rect=0%2C0%2C1800%2C1200
"6 ""Body Type"" Rules That Fashion Completely Got Wrong",https://www.instyle.com/fashion/clothing/body-type-rules-that-fashion-got-wrong,https://imagesvc.meredithcorp.io/v3/mm/image?url=https%3A%2F%2Fimagesvc.meredithcorp.io%2Fv3%2Fmm%2Fimage%3Furl%3Dhttps%253A%252F%252Fstatic.onecms.io%252Fwp-content%252Fuploads%252Fsites%252F14%252F2021%252F04%252F08%252F040821_www_body_type_lead.jpg&w=426&h=285&q=85&c=tc&rect=0%2C0%2C1800%2C1200
15 Pairs of Jeans That Look Spectacular On Long Legs,https://www.instyle.com/fashion/clothing/best-tall-jeans,
Lana Condor Wore a Lacy Sheer Dress to the 2021 Costume Designers Guild Awards,https://www.instyle.com/celebrity/lana-condor-sheer-dress-designers-guild-awards,
12 Shorts Outfit Ideas That Will Help Reinvent the Ones You Already Own,https://www.instyle.com/fashion/clothing/shorts-outfit-ideas,
Stylists Say You Should Narrow Down Your Spring Wardrobe to Just 16 Pieces,https://www.instyle.com/fashion/clothing/spring-styles-2021,
"Misha Nonoo, Meghan Markle's Go-To Basics Brand, Just Launched Plus Sizes",https://www.instyle.com/fashion/clothing/misha-nonoo-plus-sizes,
There’s a Sneaky Way to Shop the Exact Outfits From Shows Like The Nanny and Friends,https://www.instyle.com/fashion/clothing/vintage-shopping-old-tv-movie-outfits,
"I'm a Fashion Editor, and These Are the 17 Spring Dresses in My Cart Right Now",https://www.instyle.com/fashion/clothing/spring-dresses,
Summer 2021's Sexiest Dress Trend Is Secretly 90 Years Old,https://www.instyle.com/fashion/clothing/backless-dress-trend,
"Gigi Hadid, Kendall Jenner, and Jennifer Lopez Have All Been Spotted in This Must-Have Swimsuit Brand",https://www.instyle.com/fashion/clothing/frankies-bikinis-nordstrom,
Summer's Hottest Swimsuit Trend Looks Fancy and Expensive — But It's Not,https://www.instyle.com/fashion/clothing/lurex-swimwear-fashion-trend,
"Skai Jackson On Social Media, Statement Tees, and Her Favorite Petite Styling Hacks",https://www.instyle.com/fashion/clothing/skai-jackson-aerie-interview,
Victoria Beckham Wore Leopard Print With a Lace Cutout,https://www.instyle.com/celebrity/victoria-beckham/victoria-beckham-leopard-print-lace-dress,
Halle Berry Wore a See-Through Mesh Gown,https://www.instyle.com/celebrity/halle-berry/halle-berry-see-through-mesh-gown,
The French Bikini Is the One Swimwear Trend That Works for Small and Large Chests,https://www.instyle.com/fashion/clothing/french-bikini,
Mandy Moore’s 'Ugly' Cardigan From A Walk To Remember Deserved Better,https://www.instyle.com/fashion/clothing/mandy-moore-sweater-a-walk-to-remember,
"Yes, Clogs Have Returned",https://www.instyle.com/fashion/shoes/clogs-shoes-fashion-trend,
There's a Reason This Popular Spring Dress Trend Looks So Familiar,https://www.instyle.com/fashion/clothing/empire-waist-dress-trend,
5 Fashion People on What They're Actually Wearing During the Pandemic,https://www.instyle.com/fashion/fashion-people-wearing-in-quarantine,
Law Roach Wants to Help You Find Timeless Vintage Pieces,https://www.instyle.com/fashion/clothing/law-roach-tradesy-vintage-fashion,
"I’m a Millennial, But These Are the 8 'Bad' Fashion Trends Gen Z Got Right",https://www.instyle.com/fashion/clothing/easy-gen-z-fashion-trends,
This Celeb-Loved Swimsuit Brand Just Released the Cutest Matching Family Collection,https://www.instyle.com/fashion/clothing/sara-foster-summersalt-family-bathing-suits,
"8 ""In-Betweener"" Influencers to Follow For Mid-Size Fashion Inspiration",https://www.instyle.com/fashion/street-style/inbetweener-mid-size-fashion-influencers,
"Not to Upset You, But Ashley Tisdale's Cringey '00s Outfits Are Cool Again",https://www.instyle.com/celebrity/ashley-tisdale/ashley-tisdale-2000s-outfits,
Kate Hudson Wore the World's Best Outfit in 2004's Raising Helen,https://www.instyle.com/fashion/clothing/kate-hudson-raising-helen-sweater,https://imagesvc.meredithcorp.io/v3/mm/image?url=https%3A%2F%2Fimagesvc.meredithcorp.io%2Fv3%2Fmm%2Fimage%3Furl%3Dhttps%253A%252F%252Fstatic.onecms.io%252Fwp-content%252Fuploads%252Fsites%252F14%252F2021%252F03%252F24%252F032421_made_a_scene_lead-2000.jpg&w=426&h=285&q=85&c=tc
Jennifer Hudson's Hot Pants and T-Shirt Outfit Is a Summer 2021 Vibe,https://www.instyle.com/celebrity/jennifer-hudson/jennifer-hudson-wore-hot-pants,https://imagesvc.meredithcorp.io/v3/mm/image?url=https%3A%2F%2Fimagesvc.meredithcorp.io%2Fv3%2Fmm%2Fimage%3Furl%3Dhttps%253A%252F%252Fstatic.onecms.io%252Fwp-content%252Fuploads%252Fsites%252F14%252F2021%252F03%252F23%252F032321-News-Jennifer-Hudson-Lead-2000.jpg&w=426&h=285&q=85&c=tc&rect=334%2C134%2C1102%2C646
Demi Lovato Wore a No-Pants Blazer Outfit to the Premiere of Dancing With The Devil,https://www.instyle.com/celebrity/demi-lovato/demi-lovato-dancing-with-the-devil-premiere-outfit,
"The Best Outfit Idea for Your Zodiac Sign, According to an Astrologer",https://www.instyle.com/fashion/clothing/zodiac-outfits,
Nordstrom Just Put Hundreds of Jeans on Sale — Including Jennifer Garner and Jennifer Aniston's Favorites,https://www.instyle.com/fashion/nordstrom-secret-celebrity-approved-denim-sale,
23 Asian American Fashion Brands to Support Now and Always,https://www.instyle.com/fashion/clothing/asian-american-fashion-brands,
Hear Me Out: Scooby Doo Has Some Great Outfit Ideas For 2021,https://www.instyle.com/fashion/clothing/scooby-doo-fashion-outfit-ideas,
10 In-Between Spring Jackets That Will Definitely Come in Handy This Season,https://www.instyle.com/fashion/clothing/best-spring-jackets-for-women,
"11 Skirt Outfits to Wear Now, Because We're So Tired of Sweatpants",https://www.instyle.com/fashion/clothing/skirt-outfit-ideas,
"If Low-Rise Makes You Cringe, You’ll Really Hate Thong Jeans",https://www.instyle.com/fashion/clothing/thong-jeans-cutout-pants-trend,
"Halle Berry Invented These 13 Fashion Trends, and You Can’t Convince Us Otherwise",https://www.instyle.com/celebrity/halle-berry/halle-berry-90s-00s-fashion-trends,
"Cynthia Erivo's Grammys Dress Included Over 60,000 Glass Beads, Crystals, and Sequins",https://www.instyle.com/awards-events/red-carpet/grammys/cynthia-erivo-grammys-dress-louis-vuitton,
Noah Cyrus Had a Gravity Defying Moment at the Grammys,https://www.instyle.com/awards-events/red-carpet/grammys/noah-cyrus-grammys-2021-dress,
Megan Fox Has Been Pulling This Truly Immortal Fashion Formula For Months,https://www.instyle.com/celebrity/megan-fox/megan-fox-black-outfits,
Sarah Jessica Parker Has Been Pulling These 10 Fashion Tricks Since the '80s,https://www.instyle.com/celebrity/sarah-jessica-parker/sarah-jessica-parker-fashion-rules,
We're Still Not Over the Confusing '00s Dress-Over-Pants Trend — and Now It's Back,https://www.instyle.com/fashion/clothing/dress-over-pants-fashion-trend,
Halle Berry Wore a Very Sheer Crop Top and Tulle Ball Gown Skirt Just Because,https://www.instyle.com/celebrity/halle-berry/halle-berry-sheer-top-tulle-skirt-christian-siriano-fall-2021,
10 Graduation Outfit Ideas That Are Actually Cute,https://www.instyle.com/fashion/clothing/what-to-wear-graduation,
10 Cute Summer Outfit Ideas to Wear All Season Long,https://www.instyle.com/fashion/clothing/cute-summer-outfit-ideas-to-wear-in-2021,
Anya Taylor-Joy's Fancy Tulle Gown Took 200 Hours to Make,https://www.instyle.com/awards-events/anya-taylor-joy-critics-choice-awards-2021,
Regina King Wore the Most Glamorous Sequined Gown to the Critics' Choice Awards,https://www.instyle.com/awards-events/regina-king-critics-choice-awards-2021-gown,
10 Outfits That Prove Bucket Hats Weirdly Look Good With Everything,https://www.instyle.com/fashion/accessories/ways-to-style-bucket-hats,
"5 TikTok Fashion Trends to Try, ASAP",https://www.instyle.com/fashion/tiktok-fashion-trends-interview,
'Vaccine Shirts' Are the New Going Out Tops,https://www.instyle.com/fashion/clothing/vaccine-cutout-cold-shoulder-shirts,
Underwear-Tops and Upside-Down Bikinis Are 2021's Weird Yet Viral Swimsuit Trends,https://www.instyle.com/fashion/clothing/best-swimsuit-trends-2021,
Jennifer Lopez's Go-To Brand For Basics Just Dropped the Coolest Spring Collection,https://www.instyle.com/fashion/clothing/the-range-fashion-interview,https://imagesvc.meredithcorp.io/v3/mm/image?url=https%3A%2F%2Fimagesvc.meredithcorp.io%2Fv3%2Fmm%2Fimage%3Furl%3Dhttps%253A%252F%252Fstatic.onecms.io%252Fwp-content%252Fuploads%252Fsites%252F14%252F2021%252F03%252F02%252Fthe-range-2.jpeg&w=426&h=285&q=85&c=tc&rect=78%2C236%2C760%2C691
"Hailee Steinfeld’s Frankies Bikini Collaboration Includes Sexy, Printed Swimsuits and So Many Matching Sets",https://www.instyle.com/fashion/clothing/frankies-bikinis-hailee-steinfeld-collaboration,https://imagesvc.meredithcorp.io/v3/mm/image?url=https%3A%2F%2Fimagesvc.meredithcorp.io%2Fv3%2Fmm%2Fimage%3Furl%3Dhttps%253A%252F%252Fstatic.onecms.io%252Fwp-content%252Fuploads%252Fsites%252F14%252F2021%252F03%252F02%252FFrankies-Bikinis-main-2000.jpg&w=426&h=285&q=85&c=tc&rect=200%2C241%2C1800%2C1307
It Took 300 Hours to Make Anya Taylor-Joy's Golden Globes Dress,https://www.instyle.com/awards-events/red-carpet/golden-globes/anya-taylor-joy-golden-globes-2021-dior-dress-300-hours,
Meghan Markle Wore a $30 Dress on FaceTime with Prince Harry,https://www.instyle.com/celebrity/meghan-markle/meghan-markle-affordable-velvet-torch-dress,
