Blog Title,Blog Link,Thumbnail Link
This Meghan-Markle-Loved Designer Is About to Change the Entire Fashion Industry,https://www.instyle.com/fashion/in-the-blk-victor-glemaud,
Netflix and Panic Is the New Netflix and Chill,https://www.instyle.com/lifestyle/mask-anxiety-tv-netflix-and-panic,
Jennifer Lopez Just Pulled the Fashion Move You Loved in Middle School,https://www.instyle.com/look-of-the-day/2020-10-14,
"Well, It Looks Like Kate Middleton Is Trying to Bring Back a Popular '80s Trend",https://www.instyle.com/celebrity/kate-middleton/kate-middleton-black-suit-blazer-natural-history-museum,
2020's Highly-Debated Outfit Trick Is Actually Extremely Popular,https://www.instyle.com/fashion/clothing/matching-face-mask-outfits,
Dua Lipa Gave This 2000s Emo Kid Outfit a 2020 Upgrade,https://www.instyle.com/look-of-the-day/2020-10-12,
14 Last-Minute Halloween Costumes You Can Make With Your Own Clothes,https://www.instyle.com/holidays-occasions/halloween/last-minute-halloween-costumes,
So Many Celebrities Have Worn the Exact Same Outfit This Week,https://www.instyle.com/celebrity/so-many-celebrities-have-worn-the-exact-same-outfit-this-week,
This Classic Fall Color Weirdly Looks Good On Everyone,https://www.instyle.com/fashion/clothing/burgundy-outfits,
The Poet Blouse Is the Spring 2021 Trend Worth Shopping Now,https://www.instyle.com/fashion/clothing/best-fashion-trends-spring-2021,
Irina Shayk Pushed a Stroller Around New York City in a Robe and Knee-High Boots,https://www.instyle.com/look-of-the-day/2020-10-05,
6 Unexpected Ways to Style a Leather Jacket For Fall 2020,https://www.instyle.com/fashion/clothing/leather-jacket-outfits,
Emily Ratajkowski Still Wears This $5 Thrift Store Find She Bought When She Was 17,https://www.instyle.com/celebrity/emily-ratajkowski/emily-ratajkowski-nasty-gal-2020-interview,
Both Emily in Paris and Sex and the City Rely on This Fun Fashion Trick,https://www.instyle.com/fashion/clothing/emily-in-paris-outfits-costume-designer-patricia-field-interview,
"7 Wild, Questionable, But Super Sexy Trends From Rihanna's Savage x Fenty Show",https://www.instyle.com/fashion/clothing/rihanna-savage-x-fenty-show-trends-amazon-prime-2020,
9 Outfits That Prove Ankle Boots Go With Everything,https://www.instyle.com/fashion/shoes/how-to-wear-ankle-boots,
22 Celebrity Outfits That Actually Make the Best Halloween Costumes,https://www.instyle.com/holidays-occasions/halloween/celebrity-halloween-costumes-ideas,
"So, White Supremacists Ruined Another Shirt",https://www.instyle.com/fashion/clothing/fred-perry-proud-boys-polo,
18 Celebrity Outfits From the Year 2000 We Would Still Wear Today,https://www.instyle.com/fashion/clothing/best-celebrity-outfits-2000-aughts-style,
The World’s Best-Dressed People All Love This Easy Fall Fashion Trick,https://www.instyle.com/fashion/accessories/hats-style-outfit-ideas,
This Popular Supermodel Trend Is on Its Way to Replacing Leather Jackets,https://www.instyle.com/fashion/supermodels-leather-blazer-trend,
Jennifer Aniston's Famous Coat From 2006 Is Getting a Major Fashion Update,https://www.instyle.com/fashion/clothing/north-face-gucci-coat-collaboration,
"Girlfriend Collective’s New Fleece Loungewear Is So Cozy, You’ll Never Want to Take It Off",https://www.instyle.com/fashion/clothing/girlfriend-collective-fleece-sweatsuits,https://imagesvc.meredithcorp.io/v3/mm/image?url=https%3A%2F%2Fimagesvc.meredithcorp.io%2Fv3%2Fmm%2Fimage%3Furl%3Dhttps%253A%252F%252Fstatic.onecms.io%252Fwp-content%252Fuploads%252Fsites%252F14%252F2020%252F09%252F24%252F092420_girlfriend_sweatsuits_lead-2000.jpg&w=426&h=285&q=85&c=tc&rect=0%2C0%2C2000%2C1333
12 Sweater Weather Outfits That Look So Freakin’ Cozy,https://www.instyle.com/fashion/clothing/sweater-outfits,https://imagesvc.meredithcorp.io/v3/mm/image?url=https%3A%2F%2Fimagesvc.meredithcorp.io%2Fv3%2Fmm%2Fimage%3Furl%3Dhttps%253A%252F%252Fstatic.onecms.io%252Fwp-content%252Fuploads%252Fsites%252F14%252F2020%252F09%252F23%252Fsweater-outfit-lead-2000.jpg&w=426&h=285&q=85&c=tc&rect=321%2C172%2C1921%2C1238
The Internet-Famous 'Nap Dress' Just Received a Fall Update,https://www.instyle.com/fashion/clothing/hill-house-home-nap-dress-shop,
Jennifer Aniston Has Been Wearing This One Sexy Wardrobe Staple to Award Shows for Years,https://www.instyle.com/fashion/clothing/jennifer-aniston-black-slipdress-award-shows,
29 Street Style Looks You *Almost* Missed at Fashion Week,https://www.instyle.com/fashion/street-style/fashion-week-street-style-plus-size-outfits-2020,
Kate Middleton Just Wore the Fall 2020 Version of Princess Diana's Famous Pants,https://www.instyle.com/celebrity/kate-middleton/kate-middleton-pink-pants-princess-diana,
"This Cool-Girl Brand Made the Most Popular Boots of 2020, and Now You Can Shop It on Amazon",https://www.instyle.com/fashion/simon-miller-amazon,
"Regina King's Emmys Dress Looks Like a Giant, Fancy, Jeweled Pillow",https://www.instyle.com/awards-events/red-carpet/emmys/regina-king-emmys-schiaperelli-couture-dress-pillow,
"From Rare Designer Goods at Nordstrom Rack to Jill Biden's Viral Boots, These Are the Best Things to Buy This Weekend",https://www.instyle.com/shopping/weekend-shopping-roundup-2020-09-18,
7 Ways to Mix Prints Like a Pro,https://www.instyle.com/fashion/clothing/tips-for-how-to-mix-prints-in-fashion,
The New Life of Lanvin,https://www.instyle.com/fashion/lanvin-bruno-sialelli,
I’ve Replaced My Sweats With This Fancy Yet Lazy Pants Trend,https://www.instyle.com/fashion/clothing/plisse-pants-pleated-trend,
"Even Tommy Hilfiger Is Over ""Trend-Chasing""",https://www.instyle.com/awards-events/fashion-week/tommy-hilfiger-jasmine-sanders-future-fashion-week,
"Yes, Naomi Osaka Just Released a Fashion Collaboration, Too",https://www.instyle.com/fashion/naomi-osaka-fashion-adeam-collaboration-shop,
Traditional Runway Shows May Not Be the Answer to the Future of Fashion,https://www.instyle.com/awards-events/fashion-week/fashion-week-shows-necessary-digital,
Saoirse Ronan's Outfit Will Have You Convinced We're Back in 2010,https://www.instyle.com/fashion/clothing/saoirse-ronan-denim-skirt-tights-outfit,
Kim Kardashian Responded to Backlash Over Her Skims Maternity Collection,https://www.instyle.com/celebrity/kim-kardashian-skims-maternity-collection-backlash,
Ozark’s Julia Garner's Favorite Dress Cost Her $12 in 2009,https://www.instyle.com/fashion/clothing/julia-garner-ozark-razr-fashion-interview,
Melissa McCarthy Is Bringing Back a Very '00s Trend With Her New Collab,https://www.instyle.com/fashion/clare-v-melissa-mccarthy-collaboration,
21 Plus-Size Costumes You Can Easily DIY This Halloween,https://www.instyle.com/fashion/clothing/plus-size-halloween-costumes,
3 Summer Staples That Will Make Fall Outfits Even Better,https://www.instyle.com/fashion/clothing/how-to-wear-summer-clothes-fall,
Celebrity Stylist Micaela Erlanger’s New Fashion Line Goes Up to Size 36,https://www.instyle.com/fashion/clothing/stylist-micaela-erlanger-qvc-collection-size-inclusive,
11 Flannel Outfits That'll Actually Make You Excited For Fall,https://www.instyle.com/fashion/clothing/how-to-wear-flannel,
Stella McCartney Says There Are Two Key Essentials to Add to Your Fall Workout Wardrobe,https://www.instyle.com/fashion/stella-mccartney-adidas-fall-winter-2020-collection,
"13 Outfits to Wear On Those Weird, In-Between, 60-Degree Days",https://www.instyle.com/fashion/clothing/what-to-wear-60-degree-weather-outfits,
